run_id	save_rate	average_reward	save_lift	reward_lift	alignment	trust	regression	status	mutation_type	description
35	0.0000	0.0000	0.0000	0.0000	0.0000	0.0000	pass	keep	generation_round	generation 6 complete
36	0.6965	0.7311	0.0000	0.0000	0.3251	0.8120	pass	discard	context_arms	[Win-Back Researcher] [LLM] context break|free|pause_plan_relief alpha+=3, beta+=-1 — Dormant or fatigued free users citing a break already show the strongest trust-preserving save signal with pause_plan_relief, so modestly biasing this context toward pause should lift saves without adding sales pressure.
37	0.6965	0.7311	0.0000	0.0000	0.3251	0.8120	pass	discard	context_arms	[Retention Psychologist] [LLM] context break|free|pause_plan_relief alpha+=3, beta+=-1 — Learners citing a break are highly responsive to a low-friction pause that preserves identity and streak momentum, so strengthening this proven context-action prior should raise saves without undermining trust.
38	0.7485	0.7665	0.0520	0.0353	0.4317	0.7925	pass	keep	arm_priors	[Offer Economist] [LLM] targeted_discount_20 alpha+=4, beta+=-1 — Shifting discount traffic toward the 20% offer should preserve trust and LTV better than 40% while still exploiting a strong observed save rate, helping trace the efficient frontier below the current high-discount bias.
39	0.7485	0.7665	0.0000	0.0000	0.4317	0.7925	pass	discard	context_arms	[Lifecycle Strategist] [LLM] context break|free|pause_plan_relief alpha+=3, beta+=-1 — Users signaling a temporary break are in a reversible lifecycle stage, and strengthening pause_plan_relief for break|free should increase saves by matching a low-trust-risk intervention to short-term disengagement.
40	0.7485	0.7665	0.0000	0.0000	0.4317	0.7925	pass	discard	exploration_rate	[Support Concierge] [LLM] exploration_rate 0.150 -> 0.100 — Reducing exploration from 0.15 to 0.10 should route more traffic to stronger trusted arms like concierge_recovery, pause_plan_relief, and feature_value_recap while preserving enough learning given the still-small sample sizes.
41	0.7485	0.7665	0.0000	0.0000	0.4317	0.7925	pass	discard	reason_routing	[Trust Guardian] [LLM] deny targeted_discount_40 for feature_gap — Blocking the strongest discount for feature-gap cancellations avoids a manipulative mismatch where price-cutting is unlikely to solve the stated problem, preserving trust while steering traffic toward better-fitting non-discount saves.
42	0.7485	0.7665	0.0000	0.0000	0.4317	0.7925	pass	discard	exploration_rate	[Experiment Operator] [LLM] exploration_rate 0.150 -> 0.060 — With only 300 resolved outcomes and several clearly dominant non-control arms already identified, reducing exploration from 0.15 to 0.06 should route more traffic to proven higher-save options while preserving enough learning to avoid trust-harming overcommitment.
43	0.7305	0.7745	-0.0180	0.0080	0.3825	0.7994	pass	discard	arm_priors	[Product Storyteller] [LLM] feature_value_recap alpha+=4, beta+=-1 — Feature value recap is already a strong non-discount save path with solid global performance, so modestly favoring it should increase saves by helping more users realize existing product value without introducing trust risk.
43	0.0000	0.0000	0.0000	0.0000	0.0000	0.0000	pass	keep	generation_round	generated pause_plan_relief:s163
43	0.0000	0.0000	0.0000	0.0000	0.0000	0.0000	pass	keep	generation_round	generated pause_plan_relief:s164
43	0.0000	0.0000	0.0000	0.0000	0.0000	0.0000	pass	keep	generation_round	generated pause_plan_relief:s165
43	0.0000	0.0000	0.0000	0.0000	0.0000	0.0000	pass	keep	generation_round	generated downgrade_lite_switch:s166
43	0.0000	0.0000	0.0000	0.0000	0.0000	0.0000	pass	keep	generation_round	generated downgrade_lite_switch:s167
43	0.0000	0.0000	0.0000	0.0000	0.0000	0.0000	pass	keep	generation_round	generated downgrade_lite_switch:s168
43	0.0000	0.0000	0.0000	0.0000	0.0000	0.0000	pass	keep	generation_round	generated targeted_discount_20:s169
43	0.0000	0.0000	0.0000	0.0000	0.0000	0.0000	pass	keep	generation_round	generated targeted_discount_20:s170
43	0.0000	0.0000	0.0000	0.0000	0.0000	0.0000	pass	keep	generation_round	generated targeted_discount_20:s171
43	0.0000	0.0000	0.0000	0.0000	0.0000	0.0000	pass	keep	generation_round	generated targeted_discount_40:s172
43	0.0000	0.0000	0.0000	0.0000	0.0000	0.0000	pass	keep	generation_round	generated targeted_discount_40:s173
43	0.0000	0.0000	0.0000	0.0000	0.0000	0.0000	pass	keep	generation_round	generated targeted_discount_40:s174
43	0.0000	0.0000	0.0000	0.0000	0.0000	0.0000	pass	keep	generation_round	generated concierge_recovery:s175
43	0.0000	0.0000	0.0000	0.0000	0.0000	0.0000	pass	keep	generation_round	generated concierge_recovery:s176
43	0.0000	0.0000	0.0000	0.0000	0.0000	0.0000	pass	keep	generation_round	generated concierge_recovery:s177
43	0.0000	0.0000	0.0000	0.0000	0.0000	0.0000	pass	keep	generation_round	generated exam_sprint_focus:s178
43	0.0000	0.0000	0.0000	0.0000	0.0000	0.0000	pass	keep	generation_round	generated exam_sprint_focus:s179
43	0.0000	0.0000	0.0000	0.0000	0.0000	0.0000	pass	keep	generation_round	generated exam_sprint_focus:s180
43	0.0000	0.0000	0.0000	0.0000	0.0000	0.0000	pass	keep	generation_round	generated feature_value_recap:s181
43	0.0000	0.0000	0.0000	0.0000	0.0000	0.0000	pass	keep	generation_round	generated feature_value_recap:s182
43	0.0000	0.0000	0.0000	0.0000	0.0000	0.0000	pass	keep	generation_round	generated feature_value_recap:s183
43	0.0000	0.0000	0.0000	0.0000	0.0000	0.0000	pass	keep	generation_round	generated billing_clarity_reset:s184
43	0.0000	0.0000	0.0000	0.0000	0.0000	0.0000	pass	keep	generation_round	generated billing_clarity_reset:s185
43	0.0000	0.0000	0.0000	0.0000	0.0000	0.0000	pass	keep	generation_round	generated billing_clarity_reset:s186
43	0.0000	0.0000	0.0000	0.0000	0.0000	0.0000	pass	keep	generation_round	generated control_empathic_exit:s187
43	0.0000	0.0000	0.0000	0.0000	0.0000	0.0000	pass	keep	generation_round	generated control_empathic_exit:s188
43	0.0000	0.0000	0.0000	0.0000	0.0000	0.0000	pass	keep	generation_round	generated control_empathic_exit:s189
43	0.0000	0.0000	0.0000	0.0000	0.0000	0.0000	pass	keep	generation_round	synced strategy_arms for pause_plan_relief (8 strategies)
43	0.0000	0.0000	0.0000	0.0000	0.0000	0.0000	pass	keep	generation_round	synced strategy_arms for downgrade_lite_switch (8 strategies)
43	0.0000	0.0000	0.0000	0.0000	0.0000	0.0000	pass	keep	generation_round	synced strategy_arms for targeted_discount_20 (8 strategies)
43	0.0000	0.0000	0.0000	0.0000	0.0000	0.0000	pass	keep	generation_round	synced strategy_arms for targeted_discount_40 (8 strategies)
43	0.0000	0.0000	0.0000	0.0000	0.0000	0.0000	pass	keep	generation_round	synced strategy_arms for concierge_recovery (8 strategies)
43	0.0000	0.0000	0.0000	0.0000	0.0000	0.0000	pass	keep	generation_round	synced strategy_arms for exam_sprint_focus (8 strategies)
43	0.0000	0.0000	0.0000	0.0000	0.0000	0.0000	pass	keep	generation_round	synced strategy_arms for feature_value_recap (8 strategies)
43	0.0000	0.0000	0.0000	0.0000	0.0000	0.0000	pass	keep	generation_round	synced strategy_arms for billing_clarity_reset (8 strategies)
43	0.0000	0.0000	0.0000	0.0000	0.0000	0.0000	pass	keep	generation_round	synced strategy_arms for control_empathic_exit (8 strategies)
43	0.0000	0.0000	0.0000	0.0000	0.0000	0.0000	pass	keep	generation_round	pruned pause_plan_relief: ['s55', 's110', 's163']
43	0.0000	0.0000	0.0000	0.0000	0.0000	0.0000	pass	keep	generation_round	pruned downgrade_lite_switch: ['s166', 's168', 's167']
43	0.0000	0.0000	0.0000	0.0000	0.0000	0.0000	pass	keep	generation_round	pruned targeted_discount_20: ['s34', 's171', 's170']
43	0.0000	0.0000	0.0000	0.0000	0.0000	0.0000	pass	keep	generation_round	pruned targeted_discount_40: ['s173', 's174', 's172']
43	0.0000	0.0000	0.0000	0.0000	0.0000	0.0000	pass	keep	generation_round	pruned concierge_recovery: ['s67', 's177', 's175']
43	0.0000	0.0000	0.0000	0.0000	0.0000	0.0000	pass	keep	generation_round	pruned exam_sprint_focus: ['s180', 's18', 's178']
43	0.0000	0.0000	0.0000	0.0000	0.0000	0.0000	pass	keep	generation_round	pruned feature_value_recap: ['s74', 's102', 's182']
43	0.0000	0.0000	0.0000	0.0000	0.0000	0.0000	pass	keep	generation_round	pruned billing_clarity_reset: ['s186', 's184', 's185']
43	0.0000	0.0000	0.0000	0.0000	0.0000	0.0000	pass	keep	generation_round	pruned control_empathic_exit: ['s189', 's27', 's187']
43	0.0000	0.0000	0.0000	0.0000	0.0000	0.0000	pass	keep	generation_round	generation 7 complete
44	0.7499	0.7673	0.0000	0.0000	0.4317	0.7971	pass	discard	context_arms	[Deadline Operator] [LLM] context graduating|free|exam_sprint_focus alpha+=3, beta+=-1 — For deadline-driven graduating users, modestly favoring exam_sprint_focus should capture the highest-leverage near-term save opportunity without relying on discounts or reducing trust.
45	0.7098	0.7089	-0.0401	-0.0584	0.5956	0.8161	fail	discard	arm_priors	[Win-Back Researcher] [LLM] pause_plan_relief alpha+=4, beta+=-1 — Dormant or fatigued users are more likely to respond to a low-pressure comeback path, and strengthening pause_plan_relief should shift traffic toward a high-performing trust-preserving save option over harder-sell alternatives.
46	0.7568	0.7634	0.0069	-0.0039	0.4536	0.8022	pass	keep	arm_priors	[Retention Psychologist] [LLM] downgrade_lite_switch alpha+=3, beta+=-1 — Favoring downgrade_lite_switch should improve saves by preserving learner identity and streak momentum with a lower-commitment path, leveraging strong observed performance without the trust risk of heavier discounting.
47	0.7980	0.7950	0.0412	0.0316	0.5464	0.7781	fail	discard	arm_priors	[Offer Economist] [LLM] targeted_discount_20 alpha+=3, beta+=-1 — A modest prior boost toward the 20% discount should capture price-sensitive saves on a more efficient frontier than 40%, improving save rate while limiting unnecessary revenue erosion and preserving trust.
48	0.7568	0.7634	0.0000	0.0000	0.4536	0.8022	pass	discard	context_arms	[Lifecycle Strategist] [LLM] context graduating|free|downgrade_lite_switch alpha+=3, beta+=-1 — Users signaling graduation on the free plan appear to be in a natural downsizing lifecycle stage, and strengthening downgrade_lite_switch in this context should increase saves by matching a lower-commitment option to their likely transition without introducing trust risk.
49	0.7287	0.7793	-0.0281	0.0159	0.3470	0.8153	pass	discard	arm_priors	[Support Concierge] [LLM] concierge_recovery alpha+=3, beta+=-1 — Concierge recovery is a strong non-discount arm with solid global performance and support-aligned trust characteristics, so a modest prior boost should increase routing toward warm handoff opportunities without materially increasing risk.
50	0.7568	0.7634	0.0000	0.0000	0.4536	0.8022	pass	discard	reason_routing	[Trust Guardian] [LLM] deny targeted_discount_40 for quality_bug — Blocking a deep discount for quality_bug avoids a manipulative mismatch where users want product fixes rather than price relief, preserving trust while steering traffic toward better-aligned save actions.
51	0.7568	0.7634	0.0000	0.0000	0.4536	0.8022	pass	discard	exploration_rate	[Experiment Operator] [LLM] exploration_rate 0.150 -> 0.080 — With only 300 resolved outcomes and several strong arms already separating from a near-zero control, reducing exploration from 0.15 to 0.08 should send more traffic to proven non-discount options while preserving enough learning to avoid harming trust.
52	0.7568	0.7634	0.0000	0.0000	0.4536	0.8022	pass	discard	context_arms	[Product Storyteller] [LLM] context feature_gap|starter|feature_value_recap alpha+=3, beta+=-1 — For feature-gap cancellations on starter plans, favoring feature_value_recap should improve saves by surfacing already-created product value before resorting to discounts, aligning with strong global performance while preserving trust.
52	0.0000	0.0000	0.0000	0.0000	0.0000	0.0000	pass	keep	generation_round	generated pause_plan_relief:s190
52	0.0000	0.0000	0.0000	0.0000	0.0000	0.0000	pass	keep	generation_round	generated pause_plan_relief:s191
52	0.0000	0.0000	0.0000	0.0000	0.0000	0.0000	pass	keep	generation_round	generated pause_plan_relief:s192
52	0.0000	0.0000	0.0000	0.0000	0.0000	0.0000	pass	keep	generation_round	generated downgrade_lite_switch:s193
52	0.0000	0.0000	0.0000	0.0000	0.0000	0.0000	pass	keep	generation_round	generated downgrade_lite_switch:s194
52	0.0000	0.0000	0.0000	0.0000	0.0000	0.0000	pass	keep	generation_round	generated downgrade_lite_switch:s195
52	0.0000	0.0000	0.0000	0.0000	0.0000	0.0000	pass	keep	generation_round	generated targeted_discount_20:s196
52	0.0000	0.0000	0.0000	0.0000	0.0000	0.0000	pass	keep	generation_round	generated targeted_discount_20:s197
52	0.0000	0.0000	0.0000	0.0000	0.0000	0.0000	pass	keep	generation_round	generated targeted_discount_20:s198
52	0.0000	0.0000	0.0000	0.0000	0.0000	0.0000	pass	keep	generation_round	generated targeted_discount_40:s199
52	0.0000	0.0000	0.0000	0.0000	0.0000	0.0000	pass	keep	generation_round	generated targeted_discount_40:s200
52	0.0000	0.0000	0.0000	0.0000	0.0000	0.0000	pass	keep	generation_round	generated targeted_discount_40:s201
52	0.0000	0.0000	0.0000	0.0000	0.0000	0.0000	pass	keep	generation_round	generated concierge_recovery:s202
52	0.0000	0.0000	0.0000	0.0000	0.0000	0.0000	pass	keep	generation_round	generated concierge_recovery:s203
52	0.0000	0.0000	0.0000	0.0000	0.0000	0.0000	pass	keep	generation_round	generated concierge_recovery:s204
52	0.0000	0.0000	0.0000	0.0000	0.0000	0.0000	pass	keep	generation_round	generated exam_sprint_focus:s205
52	0.0000	0.0000	0.0000	0.0000	0.0000	0.0000	pass	keep	generation_round	generated exam_sprint_focus:s206
52	0.0000	0.0000	0.0000	0.0000	0.0000	0.0000	pass	keep	generation_round	generated exam_sprint_focus:s207
52	0.0000	0.0000	0.0000	0.0000	0.0000	0.0000	pass	keep	generation_round	generated feature_value_recap:s208
52	0.0000	0.0000	0.0000	0.0000	0.0000	0.0000	pass	keep	generation_round	generated feature_value_recap:s209
52	0.0000	0.0000	0.0000	0.0000	0.0000	0.0000	pass	keep	generation_round	generated feature_value_recap:s210
52	0.0000	0.0000	0.0000	0.0000	0.0000	0.0000	pass	keep	generation_round	generated billing_clarity_reset:s211
52	0.0000	0.0000	0.0000	0.0000	0.0000	0.0000	pass	keep	generation_round	generated billing_clarity_reset:s212
52	0.0000	0.0000	0.0000	0.0000	0.0000	0.0000	pass	keep	generation_round	generated billing_clarity_reset:s213
52	0.0000	0.0000	0.0000	0.0000	0.0000	0.0000	pass	keep	generation_round	generated control_empathic_exit:s214
52	0.0000	0.0000	0.0000	0.0000	0.0000	0.0000	pass	keep	generation_round	generated control_empathic_exit:s215
52	0.0000	0.0000	0.0000	0.0000	0.0000	0.0000	pass	keep	generation_round	generated control_empathic_exit:s216
52	0.0000	0.0000	0.0000	0.0000	0.0000	0.0000	pass	keep	generation_round	synced strategy_arms for pause_plan_relief (8 strategies)
52	0.0000	0.0000	0.0000	0.0000	0.0000	0.0000	pass	keep	generation_round	synced strategy_arms for downgrade_lite_switch (8 strategies)
52	0.0000	0.0000	0.0000	0.0000	0.0000	0.0000	pass	keep	generation_round	synced strategy_arms for targeted_discount_20 (8 strategies)
52	0.0000	0.0000	0.0000	0.0000	0.0000	0.0000	pass	keep	generation_round	synced strategy_arms for targeted_discount_40 (8 strategies)
52	0.0000	0.0000	0.0000	0.0000	0.0000	0.0000	pass	keep	generation_round	synced strategy_arms for concierge_recovery (8 strategies)
52	0.0000	0.0000	0.0000	0.0000	0.0000	0.0000	pass	keep	generation_round	synced strategy_arms for exam_sprint_focus (8 strategies)
52	0.0000	0.0000	0.0000	0.0000	0.0000	0.0000	pass	keep	generation_round	synced strategy_arms for feature_value_recap (8 strategies)
52	0.0000	0.0000	0.0000	0.0000	0.0000	0.0000	pass	keep	generation_round	synced strategy_arms for billing_clarity_reset (8 strategies)
52	0.0000	0.0000	0.0000	0.0000	0.0000	0.0000	pass	keep	generation_round	synced strategy_arms for control_empathic_exit (8 strategies)
52	0.0000	0.0000	0.0000	0.0000	0.0000	0.0000	pass	keep	generation_round	pruned pause_plan_relief: ['s192', 's191', 's190']
52	0.0000	0.0000	0.0000	0.0000	0.0000	0.0000	pass	keep	generation_round	pruned downgrade_lite_switch: ['s194', 's195', 's193']
52	0.0000	0.0000	0.0000	0.0000	0.0000	0.0000	pass	keep	generation_round	pruned targeted_discount_20: ['s144', 's197', 's198']
52	0.0000	0.0000	0.0000	0.0000	0.0000	0.0000	pass	keep	generation_round	pruned targeted_discount_40: ['s199', 's201', 's200']
52	0.0000	0.0000	0.0000	0.0000	0.0000	0.0000	pass	keep	generation_round	pruned concierge_recovery: ['s203', 's204', 's202']
52	0.0000	0.0000	0.0000	0.0000	0.0000	0.0000	pass	keep	generation_round	pruned exam_sprint_focus: ['s125', 's207', 's205']
52	0.0000	0.0000	0.0000	0.0000	0.0000	0.0000	pass	keep	generation_round	pruned feature_value_recap: ['s208', 's210', 's209']
52	0.0000	0.0000	0.0000	0.0000	0.0000	0.0000	pass	keep	generation_round	pruned billing_clarity_reset: ['s50', 's213', 's211']
52	0.0000	0.0000	0.0000	0.0000	0.0000	0.0000	pass	keep	generation_round	pruned control_empathic_exit: ['s216', 's215', 's214']
52	0.0000	0.0000	0.0000	0.0000	0.0000	0.0000	pass	keep	generation_round	generation 8 complete
53	0.7567	0.7634	0.0000	0.0000	0.4536	0.7972	pass	discard	context_arms	[Deadline Operator] [LLM] context graduating|free|exam_sprint_focus alpha+=3, beta+=-1 — For exam- or deadline-driven free users nearing graduation, a small prior boost to exam_sprint_focus should increase routing toward the most urgency-aligned save action without introducing deceptive pressure or broad trust risk.
54	0.7567	0.7634	0.0000	0.0000	0.4536	0.7972	pass	discard	context_arms	[Win-Back Researcher] [LLM] context break|free|pause_plan_relief alpha+=2, beta+=-1 — Users signaling a break on the free plan look like classic fatigued users, and modestly favoring pause_plan_relief in this high-fit context should lift saves by offering a low-pressure comeback path without reducing trust.
55	0.7628	0.7503	0.0060	-0.0131	0.4781	0.8073	fail	discard	arm_priors	[Retention Psychologist] [LLM] downgrade_lite_switch alpha+=2, beta+=-1 — Boosting downgrade_lite_switch slightly should increase saves by preserving learner identity and streak momentum with a lower-commitment option, while staying more trust-safe than pushing discounts.
56	0.7567	0.7634	0.0000	0.0000	0.4536	0.7972	pass	discard	discount_cap	[Offer Economist] [LLM] discount_cap 1 -> 0 — Discount arms show decent save rates but past discount-prior boosts hurt reward and triggered regression, so temporarily setting the 30-day discount cap to zero should shift traffic toward strong non-discount saves like pause and downgrade, improving save efficiency without eroding trust or LTV.
57	0.7567	0.7634	0.0000	0.0000	0.4536	0.7972	pass	discard	context_arms	[Lifecycle Strategist] [LLM] context break|free|pause_plan_relief alpha+=2, beta+=-1 — Users signaling a temporary break are a strong lifecycle match for pause over cancellation, and reinforcing this high-performing context-specific arm should lift saves without adding trust risk.
58	0.7567	0.7634	0.0000	0.0000	0.4536	0.7972	pass	discard	context_arms	[Support Concierge] [LLM] context price|free|concierge_recovery alpha+=2, beta+=-1 — Price-sensitive free users already show promising concierge recovery performance and a modest context-level prior boost should route more of this high-trust, high-save segment to human help without broadly overcommitting the arm.
59	0.7567	0.7634	0.0000	0.0000	0.4536	0.7972	pass	discard	reason_routing	[Trust Guardian] [LLM] deny targeted_discount_40 for feature_gap — Blocking a steep discount for feature-gap cancellations avoids teaching users that missing product value is solved with price cuts, preserving trust while steering traffic toward better-fit non-manipulative saves.
60	0.7567	0.7634	0.0000	0.0000	0.4536	0.7972	pass	discard	exploration_rate	[Experiment Operator] [LLM] exploration_rate 0.150 -> 0.060 — With only 300 resolved outcomes and several strong non-discount arms already clearly outperforming control, lowering exploration from 0.15 to 0.06 should reduce waste on weak/uncertain traffic while preserving enough learning to protect trust and continue validating winners.
60	0.0000	0.0000	0.0000	0.0000	0.0000	0.0000	pass	keep	generation_round	generated pause_plan_relief:s217
60	0.0000	0.0000	0.0000	0.0000	0.0000	0.0000	pass	keep	generation_round	generated pause_plan_relief:s218
60	0.0000	0.0000	0.0000	0.0000	0.0000	0.0000	pass	keep	generation_round	generated pause_plan_relief:s219
60	0.0000	0.0000	0.0000	0.0000	0.0000	0.0000	pass	keep	generation_round	generated downgrade_lite_switch:s220
60	0.0000	0.0000	0.0000	0.0000	0.0000	0.0000	pass	keep	generation_round	generated downgrade_lite_switch:s221
60	0.0000	0.0000	0.0000	0.0000	0.0000	0.0000	pass	keep	generation_round	generated downgrade_lite_switch:s222
60	0.0000	0.0000	0.0000	0.0000	0.0000	0.0000	pass	keep	generation_round	generated targeted_discount_20:s223
60	0.0000	0.0000	0.0000	0.0000	0.0000	0.0000	pass	keep	generation_round	generated targeted_discount_20:s224
60	0.0000	0.0000	0.0000	0.0000	0.0000	0.0000	pass	keep	generation_round	generated targeted_discount_20:s225
60	0.0000	0.0000	0.0000	0.0000	0.0000	0.0000	pass	keep	generation_round	generated targeted_discount_40:s226
60	0.0000	0.0000	0.0000	0.0000	0.0000	0.0000	pass	keep	generation_round	generated targeted_discount_40:s227
60	0.0000	0.0000	0.0000	0.0000	0.0000	0.0000	pass	keep	generation_round	generated targeted_discount_40:s228
60	0.0000	0.0000	0.0000	0.0000	0.0000	0.0000	pass	keep	generation_round	generated concierge_recovery:s229
60	0.0000	0.0000	0.0000	0.0000	0.0000	0.0000	pass	keep	generation_round	generated concierge_recovery:s230
60	0.0000	0.0000	0.0000	0.0000	0.0000	0.0000	pass	keep	generation_round	generated concierge_recovery:s231
60	0.0000	0.0000	0.0000	0.0000	0.0000	0.0000	pass	keep	generation_round	generated exam_sprint_focus:s232
