run_id	save_rate	average_reward	save_lift	reward_lift	alignment	trust	regression	status	mutation_type	description
1	0.6010	0.6859	-0.0480	0.0206	0.3033	0.8111	pass	discard	arm_priors	[Retention Psychologist] [LLM] feature_value_recap alpha+=4, beta+=-1 — Boosting feature_value_recap should increase routing toward an action that reinforces learner identity and accumulated progress, leveraging sunk cost and habit momentum without relying on heavier incentives that could erode trust.
2	0.6490	0.6653	0.0000	0.0000	0.3852	0.8254	pass	discard	discount_cap	[Offer Economist] [LLM] discount_cap 1 -> 0 — Non-discount saves already outperform both discount arms while discounts risk unnecessary margin loss, so temporarily capping discounts should shift traffic to the more efficient frontier of pause/downgrade/value actions and improve save_rate without eroding trust.
3	0.6490	0.6653	0.0000	0.0000	0.3852	0.8254	pass	discard	reason_routing	[Lifecycle Strategist] [LLM] deny targeted_discount_40 for break — Users signaling a temporary break are a lifecycle fit for pause-oriented retention rather than high-discount rescue, so blocking 40% discount there should preserve trust and concentrate traffic on stronger stage-matched save paths like pause_plan_relief and downgrade_lite_switch.
4	0.6516	0.6989	0.0026	0.0335	0.3251	0.8248	pass	keep	arm_priors	[Support Concierge] [LLM] concierge_recovery alpha+=4, beta+=-1 — Concierge recovery is already a top non-discount performer with limited data, so modestly increasing its prior should route more eligible users to a high-trust save path without overcommitting exploration.
5	0.6516	0.6989	0.0000	0.0000	0.3251	0.8248	pass	discard	reason_routing	[Trust Guardian] [LLM] deny targeted_discount_40 for quality_bug — Blocking a deep discount for quality_bug prevents a trust-eroding mismatch where users reporting product problems feel bought off, while preserving routing toward more credible recovery actions like concierge_recovery.
6	0.6516	0.6989	0.0000	0.0000	0.3251	0.8248	pass	discard	exploration_rate	[Experiment Operator] [LLM] exploration_rate 0.150 -> 0.080 — With only 300 resolved outcomes and several strong arms already showing materially better win rates than control, reducing exploration from 0.15 to 0.08 should shift more traffic to proven non-discount winners while preserving enough learning to avoid trust-harming overcommitment.
7	0.6252	0.7133	-0.0264	0.0144	0.2459	0.8142	pass	discard	arm_priors	[Product Storyteller] [LLM] feature_value_recap alpha+=3, beta+=-1 — Feature_value_recap is already a strong non-discount performer and best fits a product-storytelling approach, so modestly favoring it should increase saves by helping more users recognize value already created without adding trust risk.
8	0.5190	0.6729	-0.1326	-0.0260	0.5519	0.6479	fail	discard	arm_priors	[Deadline Operator] [LLM] exam_sprint_focus alpha+=4, beta+=-1 — For deadline-driven users, a modest prior boost to exam_sprint_focus should increase selection of a trust-preserving urgency-relevant save path that is currently underexplored relative to stronger generic arms.
9	0.6516	0.6989	0.0000	0.0000	0.3251	0.8248	pass	discard	context_arms	[Win-Back Researcher] [LLM] context break|free|pause_plan_relief alpha+=3, beta+=-1 — Users signaling a break on the free plan are classic dormant/fatigued cases, and strengthening pause_plan_relief in this already high-performing context should lift saves by favoring a low-pressure comeback path that preserves trust.
9	0.0000	0.0000	0.0000	0.0000	0.0000	0.0000	pass	keep	generation_round	generated pause_plan_relief:s1
9	0.0000	0.0000	0.0000	0.0000	0.0000	0.0000	pass	keep	generation_round	generated pause_plan_relief:s2
9	0.0000	0.0000	0.0000	0.0000	0.0000	0.0000	pass	keep	generation_round	generated pause_plan_relief:s3
9	0.0000	0.0000	0.0000	0.0000	0.0000	0.0000	pass	keep	generation_round	generated downgrade_lite_switch:s4
9	0.0000	0.0000	0.0000	0.0000	0.0000	0.0000	pass	keep	generation_round	generated downgrade_lite_switch:s5
9	0.0000	0.0000	0.0000	0.0000	0.0000	0.0000	pass	keep	generation_round	generated downgrade_lite_switch:s6
9	0.0000	0.0000	0.0000	0.0000	0.0000	0.0000	pass	keep	generation_round	generated targeted_discount_20:s7
9	0.0000	0.0000	0.0000	0.0000	0.0000	0.0000	pass	keep	generation_round	generated targeted_discount_20:s8
9	0.0000	0.0000	0.0000	0.0000	0.0000	0.0000	pass	keep	generation_round	generated targeted_discount_20:s9
9	0.0000	0.0000	0.0000	0.0000	0.0000	0.0000	pass	keep	generation_round	generated targeted_discount_40:s10
9	0.0000	0.0000	0.0000	0.0000	0.0000	0.0000	pass	keep	generation_round	generated targeted_discount_40:s11
9	0.0000	0.0000	0.0000	0.0000	0.0000	0.0000	pass	keep	generation_round	generated targeted_discount_40:s12
9	0.0000	0.0000	0.0000	0.0000	0.0000	0.0000	pass	keep	generation_round	generated concierge_recovery:s13
9	0.0000	0.0000	0.0000	0.0000	0.0000	0.0000	pass	keep	generation_round	generated concierge_recovery:s14
9	0.0000	0.0000	0.0000	0.0000	0.0000	0.0000	pass	keep	generation_round	generated concierge_recovery:s15
9	0.0000	0.0000	0.0000	0.0000	0.0000	0.0000	pass	keep	generation_round	generated exam_sprint_focus:s16
9	0.0000	0.0000	0.0000	0.0000	0.0000	0.0000	pass	keep	generation_round	generated exam_sprint_focus:s17
9	0.0000	0.0000	0.0000	0.0000	0.0000	0.0000	pass	keep	generation_round	generated exam_sprint_focus:s18
9	0.0000	0.0000	0.0000	0.0000	0.0000	0.0000	pass	keep	generation_round	generated feature_value_recap:s19
9	0.0000	0.0000	0.0000	0.0000	0.0000	0.0000	pass	keep	generation_round	generated feature_value_recap:s20
9	0.0000	0.0000	0.0000	0.0000	0.0000	0.0000	pass	keep	generation_round	generated feature_value_recap:s21
9	0.0000	0.0000	0.0000	0.0000	0.0000	0.0000	pass	keep	generation_round	generated billing_clarity_reset:s22
9	0.0000	0.0000	0.0000	0.0000	0.0000	0.0000	pass	keep	generation_round	generated billing_clarity_reset:s23
9	0.0000	0.0000	0.0000	0.0000	0.0000	0.0000	pass	keep	generation_round	generated billing_clarity_reset:s24
9	0.0000	0.0000	0.0000	0.0000	0.0000	0.0000	pass	keep	generation_round	generated control_empathic_exit:s25
9	0.0000	0.0000	0.0000	0.0000	0.0000	0.0000	pass	keep	generation_round	generated control_empathic_exit:s26
9	0.0000	0.0000	0.0000	0.0000	0.0000	0.0000	pass	keep	generation_round	generated control_empathic_exit:s27
9	0.0000	0.0000	0.0000	0.0000	0.0000	0.0000	pass	keep	generation_round	synced strategy_arms for pause_plan_relief (4 strategies)
9	0.0000	0.0000	0.0000	0.0000	0.0000	0.0000	pass	keep	generation_round	synced strategy_arms for downgrade_lite_switch (4 strategies)
9	0.0000	0.0000	0.0000	0.0000	0.0000	0.0000	pass	keep	generation_round	synced strategy_arms for targeted_discount_20 (4 strategies)
9	0.0000	0.0000	0.0000	0.0000	0.0000	0.0000	pass	keep	generation_round	synced strategy_arms for targeted_discount_40 (4 strategies)
9	0.0000	0.0000	0.0000	0.0000	0.0000	0.0000	pass	keep	generation_round	synced strategy_arms for concierge_recovery (4 strategies)
9	0.0000	0.0000	0.0000	0.0000	0.0000	0.0000	pass	keep	generation_round	synced strategy_arms for exam_sprint_focus (4 strategies)
9	0.0000	0.0000	0.0000	0.0000	0.0000	0.0000	pass	keep	generation_round	synced strategy_arms for feature_value_recap (4 strategies)
9	0.0000	0.0000	0.0000	0.0000	0.0000	0.0000	pass	keep	generation_round	synced strategy_arms for billing_clarity_reset (4 strategies)
9	0.0000	0.0000	0.0000	0.0000	0.0000	0.0000	pass	keep	generation_round	synced strategy_arms for control_empathic_exit (4 strategies)
9	0.0000	0.0000	0.0000	0.0000	0.0000	0.0000	pass	keep	generation_round	generation 1 complete
10	0.6398	0.6443	-0.0232	-0.0583	0.5820	0.8410	fail	discard	arm_priors	[Retention Psychologist] [LLM] pause_plan_relief alpha+=4, beta+=-1 — Boosting pause_plan_relief should improve saves by favoring a high-performing, trust-preserving action that leverages habit continuity and sunk progress for learners who are wavering rather than truly done.
11	0.6630	0.7027	0.0000	0.0000	0.3251	0.8191	pass	discard	reason_routing	[Offer Economist] [LLM] deny targeted_discount_40 for feature_gap — 40% discount appears overpowered for a non-price objection while strong non-discount arms already outperform globally, so blocking it for feature-gap users should preserve trust and shift traffic to higher-LTV saves without reducing overall save rate.
12	0.6630	0.7027	0.0000	0.0000	0.3251	0.8191	pass	discard	context_arms	[Lifecycle Strategist] [LLM] context graduating|free|downgrade_lite_switch alpha+=3, beta+=-1 — Users in a graduating free-plan lifecycle are showing the clearest positive response to a lower-commitment downgrade path, so strengthening this context-action pairing should raise saves without introducing trust risk.
13	0.6456	0.7384	-0.0174	0.0357	0.2514	0.8224	pass	discard	arm_priors	[Support Concierge] [LLM] concierge_recovery alpha+=3, beta+=-1 — Concierge_recovery is a top-performing, trust-preserving arm with a prior successful boost in run 4, so a modest additional uplift should increase its selection against weak control without overcommitting.
14	0.6630	0.7027	0.0000	0.0000	0.3251	0.8191	pass	discard	reason_routing	[Trust Guardian] [LLM] deny feature_value_recap for quality_bug — Blocking feature_value_recap for quality_bug should protect trust by avoiding tone-deaf persuasion when the product is failing, while shifting traffic toward more credible recovery-oriented actions like concierge_recovery.
14	0.0000	0.0000	0.0000	0.0000	0.0000	0.0000	pass	keep	generation_round	generated pause_plan_relief:s28
14	0.0000	0.0000	0.0000	0.0000	0.0000	0.0000	pass	keep	generation_round	generated pause_plan_relief:s29
14	0.0000	0.0000	0.0000	0.0000	0.0000	0.0000	pass	keep	generation_round	generated pause_plan_relief:s30
14	0.0000	0.0000	0.0000	0.0000	0.0000	0.0000	pass	keep	generation_round	generated downgrade_lite_switch:s31
14	0.0000	0.0000	0.0000	0.0000	0.0000	0.0000	pass	keep	generation_round	generated downgrade_lite_switch:s32
14	0.0000	0.0000	0.0000	0.0000	0.0000	0.0000	pass	keep	generation_round	generated downgrade_lite_switch:s33
14	0.0000	0.0000	0.0000	0.0000	0.0000	0.0000	pass	keep	generation_round	generated targeted_discount_20:s34
14	0.0000	0.0000	0.0000	0.0000	0.0000	0.0000	pass	keep	generation_round	generated targeted_discount_20:s35
14	0.0000	0.0000	0.0000	0.0000	0.0000	0.0000	pass	keep	generation_round	generated targeted_discount_20:s36
14	0.0000	0.0000	0.0000	0.0000	0.0000	0.0000	pass	keep	generation_round	generated targeted_discount_40:s37
14	0.0000	0.0000	0.0000	0.0000	0.0000	0.0000	pass	keep	generation_round	generated targeted_discount_40:s38
14	0.0000	0.0000	0.0000	0.0000	0.0000	0.0000	pass	keep	generation_round	generated targeted_discount_40:s39
14	0.0000	0.0000	0.0000	0.0000	0.0000	0.0000	pass	keep	generation_round	generated concierge_recovery:s40
14	0.0000	0.0000	0.0000	0.0000	0.0000	0.0000	pass	keep	generation_round	generated concierge_recovery:s41
14	0.0000	0.0000	0.0000	0.0000	0.0000	0.0000	pass	keep	generation_round	generated concierge_recovery:s42
14	0.0000	0.0000	0.0000	0.0000	0.0000	0.0000	pass	keep	generation_round	generated exam_sprint_focus:s43
14	0.0000	0.0000	0.0000	0.0000	0.0000	0.0000	pass	keep	generation_round	generated exam_sprint_focus:s44
14	0.0000	0.0000	0.0000	0.0000	0.0000	0.0000	pass	keep	generation_round	generated exam_sprint_focus:s45
14	0.0000	0.0000	0.0000	0.0000	0.0000	0.0000	pass	keep	generation_round	generated feature_value_recap:s46
14	0.0000	0.0000	0.0000	0.0000	0.0000	0.0000	pass	keep	generation_round	generated feature_value_recap:s47
14	0.0000	0.0000	0.0000	0.0000	0.0000	0.0000	pass	keep	generation_round	generated feature_value_recap:s48
14	0.0000	0.0000	0.0000	0.0000	0.0000	0.0000	pass	keep	generation_round	generated billing_clarity_reset:s49
14	0.0000	0.0000	0.0000	0.0000	0.0000	0.0000	pass	keep	generation_round	generated billing_clarity_reset:s50
14	0.0000	0.0000	0.0000	0.0000	0.0000	0.0000	pass	keep	generation_round	generated billing_clarity_reset:s51
14	0.0000	0.0000	0.0000	0.0000	0.0000	0.0000	pass	keep	generation_round	generated control_empathic_exit:s52
14	0.0000	0.0000	0.0000	0.0000	0.0000	0.0000	pass	keep	generation_round	generated control_empathic_exit:s53
14	0.0000	0.0000	0.0000	0.0000	0.0000	0.0000	pass	keep	generation_round	generated control_empathic_exit:s54
14	0.0000	0.0000	0.0000	0.0000	0.0000	0.0000	pass	keep	generation_round	synced strategy_arms for pause_plan_relief (7 strategies)
14	0.0000	0.0000	0.0000	0.0000	0.0000	0.0000	pass	keep	generation_round	synced strategy_arms for downgrade_lite_switch (7 strategies)
14	0.0000	0.0000	0.0000	0.0000	0.0000	0.0000	pass	keep	generation_round	synced strategy_arms for targeted_discount_20 (7 strategies)
14	0.0000	0.0000	0.0000	0.0000	0.0000	0.0000	pass	keep	generation_round	synced strategy_arms for targeted_discount_40 (7 strategies)
14	0.0000	0.0000	0.0000	0.0000	0.0000	0.0000	pass	keep	generation_round	synced strategy_arms for concierge_recovery (7 strategies)
14	0.0000	0.0000	0.0000	0.0000	0.0000	0.0000	pass	keep	generation_round	synced strategy_arms for exam_sprint_focus (7 strategies)
14	0.0000	0.0000	0.0000	0.0000	0.0000	0.0000	pass	keep	generation_round	synced strategy_arms for feature_value_recap (7 strategies)
14	0.0000	0.0000	0.0000	0.0000	0.0000	0.0000	pass	keep	generation_round	synced strategy_arms for billing_clarity_reset (7 strategies)
14	0.0000	0.0000	0.0000	0.0000	0.0000	0.0000	pass	keep	generation_round	synced strategy_arms for control_empathic_exit (7 strategies)
14	0.0000	0.0000	0.0000	0.0000	0.0000	0.0000	pass	keep	generation_round	pruned pause_plan_relief: ['s30', 's2']
14	0.0000	0.0000	0.0000	0.0000	0.0000	0.0000	pass	keep	generation_round	pruned downgrade_lite_switch: ['s6', 's33']
14	0.0000	0.0000	0.0000	0.0000	0.0000	0.0000	pass	keep	generation_round	pruned targeted_discount_20: ['s35', 's0']
14	0.0000	0.0000	0.0000	0.0000	0.0000	0.0000	pass	keep	generation_round	pruned targeted_discount_40: ['s11', 's39']
14	0.0000	0.0000	0.0000	0.0000	0.0000	0.0000	pass	keep	generation_round	pruned concierge_recovery: ['s14', 's13']
14	0.0000	0.0000	0.0000	0.0000	0.0000	0.0000	pass	keep	generation_round	pruned exam_sprint_focus: ['s0', 's45']
14	0.0000	0.0000	0.0000	0.0000	0.0000	0.0000	pass	keep	generation_round	pruned feature_value_recap: ['s48', 's46']
14	0.0000	0.0000	0.0000	0.0000	0.0000	0.0000	pass	keep	generation_round	pruned billing_clarity_reset: ['s23', 's49']
14	0.0000	0.0000	0.0000	0.0000	0.0000	0.0000	pass	keep	generation_round	pruned control_empathic_exit: ['s25', 's0']
14	0.0000	0.0000	0.0000	0.0000	0.0000	0.0000	pass	keep	generation_round	generation 2 complete
15	0.6852	0.7160	0.0000	0.0000	0.3251	0.8032	pass	discard	exploration_rate	[Experiment Operator] [LLM] exploration_rate 0.150 -> 0.080 — With only 300 resolved outcomes and several clearly superior non-control arms already identified, lowering exploration from 0.15 to 0.08 should shift more traffic to better-performing actions while preserving enough exploration and holdout to protect trust and continue learning.
16	0.6799	0.7212	-0.0053	0.0052	0.3443	0.8075	pass	discard	context_arms	[Product Storyteller] [LLM] context feature_gap|super_learner|feature_value_recap alpha+=3, beta+=-1 — Users canceling for feature_gap on the high-intent super_learner plan are the clearest fit for a value-realization recap, and boosting this routing should shift traffic away from a proven zero-win control without requiring discounts or trust-eroding pressure.
17	0.6852	0.7160	0.0000	0.0000	0.3251	0.8032	pass	discard	context_arms	[Deadline Operator] [LLM] context graduating|free|downgrade_lite_switch alpha+=2, beta+=-1 — For exam- or deadline-driven free users near a milestone, lightly favoring downgrade_lite_switch in the proven graduating context should capture urgent short-horizon retention without relying on trust-eroding discounts.
18	0.6852	0.7160	0.0000	0.0000	0.3251	0.8032	pass	discard	context_arms	[Win-Back Researcher] [LLM] context break|free|pause_plan_relief alpha+=2, beta+=0 — Dormant or fatigued free users citing a break already show strong response to pause_plan_relief, so a modest context-specific prior boost should increase saves by favoring a low-pressure comeback path without adding sales pressure.
19	0.6852	0.7160	0.0000	0.0000	0.3251	0.8032	pass	discard	context_arms	[Retention Psychologist] [LLM] context break|free|pause_plan_relief alpha+=2, beta+=0 — For break-driven churn, pause directly preserves learner identity and study momentum without pressure, and this context already shows strong early save performance with low trust risk.
19	0.0000	0.0000	0.0000	0.0000	0.0000	0.0000	pass	keep	generation_round	generated pause_plan_relief:s55
19	0.0000	0.0000	0.0000	0.0000	0.0000	0.0000	pass	keep	generation_round	generated pause_plan_relief:s56
19	0.0000	0.0000	0.0000	0.0000	0.0000	0.0000	pass	keep	generation_round	generated pause_plan_relief:s57
19	0.0000	0.0000	0.0000	0.0000	0.0000	0.0000	pass	keep	generation_round	generated downgrade_lite_switch:s58
19	0.0000	0.0000	0.0000	0.0000	0.0000	0.0000	pass	keep	generation_round	generated downgrade_lite_switch:s59
19	0.0000	0.0000	0.0000	0.0000	0.0000	0.0000	pass	keep	generation_round	generated downgrade_lite_switch:s60
19	0.0000	0.0000	0.0000	0.0000	0.0000	0.0000	pass	keep	generation_round	generated targeted_discount_20:s61
19	0.0000	0.0000	0.0000	0.0000	0.0000	0.0000	pass	keep	generation_round	generated targeted_discount_20:s62
19	0.0000	0.0000	0.0000	0.0000	0.0000	0.0000	pass	keep	generation_round	generated targeted_discount_20:s63
19	0.0000	0.0000	0.0000	0.0000	0.0000	0.0000	pass	keep	generation_round	generated targeted_discount_40:s64
19	0.0000	0.0000	0.0000	0.0000	0.0000	0.0000	pass	keep	generation_round	generated targeted_discount_40:s65
19	0.0000	0.0000	0.0000	0.0000	0.0000	0.0000	pass	keep	generation_round	generated targeted_discount_40:s66
19	0.0000	0.0000	0.0000	0.0000	0.0000	0.0000	pass	keep	generation_round	generated concierge_recovery:s67
19	0.0000	0.0000	0.0000	0.0000	0.0000	0.0000	pass	keep	generation_round	generated concierge_recovery:s68
19	0.0000	0.0000	0.0000	0.0000	0.0000	0.0000	pass	keep	generation_round	generated concierge_recovery:s69
19	0.0000	0.0000	0.0000	0.0000	0.0000	0.0000	pass	keep	generation_round	generated exam_sprint_focus:s70
19	0.0000	0.0000	0.0000	0.0000	0.0000	0.0000	pass	keep	generation_round	generated exam_sprint_focus:s71
19	0.0000	0.0000	0.0000	0.0000	0.0000	0.0000	pass	keep	generation_round	generated exam_sprint_focus:s72
19	0.0000	0.0000	0.0000	0.0000	0.0000	0.0000	pass	keep	generation_round	generated feature_value_recap:s73
19	0.0000	0.0000	0.0000	0.0000	0.0000	0.0000	pass	keep	generation_round	generated feature_value_recap:s74
19	0.0000	0.0000	0.0000	0.0000	0.0000	0.0000	pass	keep	generation_round	generated feature_value_recap:s75
19	0.0000	0.0000	0.0000	0.0000	0.0000	0.0000	pass	keep	generation_round	generated billing_clarity_reset:s76
19	0.0000	0.0000	0.0000	0.0000	0.0000	0.0000	pass	keep	generation_round	generated billing_clarity_reset:s77
19	0.0000	0.0000	0.0000	0.0000	0.0000	0.0000	pass	keep	generation_round	generated billing_clarity_reset:s78
19	0.0000	0.0000	0.0000	0.0000	0.0000	0.0000	pass	keep	generation_round	generated control_empathic_exit:s79
19	0.0000	0.0000	0.0000	0.0000	0.0000	0.0000	pass	keep	generation_round	generated control_empathic_exit:s80
19	0.0000	0.0000	0.0000	0.0000	0.0000	0.0000	pass	keep	generation_round	generated control_empathic_exit:s81
19	0.0000	0.0000	0.0000	0.0000	0.0000	0.0000	pass	keep	generation_round	synced strategy_arms for pause_plan_relief (8 strategies)
19	0.0000	0.0000	0.0000	0.0000	0.0000	0.0000	pass	keep	generation_round	synced strategy_arms for downgrade_lite_switch (8 strategies)
19	0.0000	0.0000	0.0000	0.0000	0.0000	0.0000	pass	keep	generation_round	synced strategy_arms for targeted_discount_20 (8 strategies)
19	0.0000	0.0000	0.0000	0.0000	0.0000	0.0000	pass	keep	generation_round	synced strategy_arms for targeted_discount_40 (8 strategies)
19	0.0000	0.0000	0.0000	0.0000	0.0000	0.0000	pass	keep	generation_round	synced strategy_arms for concierge_recovery (8 strategies)
19	0.0000	0.0000	0.0000	0.0000	0.0000	0.0000	pass	keep	generation_round	synced strategy_arms for exam_sprint_focus (8 strategies)
19	0.0000	0.0000	0.0000	0.0000	0.0000	0.0000	pass	keep	generation_round	synced strategy_arms for feature_value_recap (8 strategies)
19	0.0000	0.0000	0.0000	0.0000	0.0000	0.0000	pass	keep	generation_round	synced strategy_arms for billing_clarity_reset (8 strategies)
19	0.0000	0.0000	0.0000	0.0000	0.0000	0.0000	pass	keep	generation_round	synced strategy_arms for control_empathic_exit (8 strategies)
19	0.0000	0.0000	0.0000	0.0000	0.0000	0.0000	pass	keep	generation_round	pruned pause_plan_relief: ['s29', 's1', 's56']
19	0.0000	0.0000	0.0000	0.0000	0.0000	0.0000	pass	keep	generation_round	pruned downgrade_lite_switch: ['s59', 's60', 's58']
19	0.0000	0.0000	0.0000	0.0000	0.0000	0.0000	pass	keep	generation_round	pruned targeted_discount_20: ['s7', 's8', 's63']
19	0.0000	0.0000	0.0000	0.0000	0.0000	0.0000	pass	keep	generation_round	pruned targeted_discount_40: ['s64', 's66', 's10']
19	0.0000	0.0000	0.0000	0.0000	0.0000	0.0000	pass	keep	generation_round	pruned concierge_recovery: ['s41', 's42', 's40']
19	0.0000	0.0000	0.0000	0.0000	0.0000	0.0000	pass	keep	generation_round	pruned exam_sprint_focus: ['s43', 's72', 's71']
19	0.0000	0.0000	0.0000	0.0000	0.0000	0.0000	pass	keep	generation_round	pruned feature_value_recap: ['s47', 's21', 's73']
19	0.0000	0.0000	0.0000	0.0000	0.0000	0.0000	pass	keep	generation_round	pruned billing_clarity_reset: ['s51', 's24', 's77']
19	0.0000	0.0000	0.0000	0.0000	0.0000	0.0000	pass	keep	generation_round	pruned control_empathic_exit: ['s80', 's54', 's26']
19	0.0000	0.0000	0.0000	0.0000	0.0000	0.0000	pass	keep	generation_round	generation 3 complete
