run_id	save_rate	average_reward	save_lift	reward_lift	alignment	trust	regression	status	mutation_type	description
190	0.0000	0.0000	0.0000	0.0000	0.0000	0.0000	pass	keep	generation_round	pruned exam_sprint_focus: ['s854', 's853', 's855']
190	0.0000	0.0000	0.0000	0.0000	0.0000	0.0000	pass	keep	generation_round	pruned feature_value_recap: ['s858', 's856', 's857']
190	0.0000	0.0000	0.0000	0.0000	0.0000	0.0000	pass	keep	generation_round	pruned billing_clarity_reset: ['s859', 's861', 's860']
190	0.0000	0.0000	0.0000	0.0000	0.0000	0.0000	pass	keep	generation_round	pruned control_empathic_exit: ['s863', 's864', 's862']
190	0.0000	0.0000	0.0000	0.0000	0.0000	0.0000	pass	keep	generation_round	generation 32 complete
191	0.8097	0.8045	0.0001	0.0007	0.5656	0.8022	pass	discard	arm_priors	[Offer Economist] [LLM] targeted_discount_20 alpha+=4, beta+=0 — Favoring targeted_discount_20 over deeper discounting should capture price-sensitive saves with less LTV damage, since it has strong strategy quality and solid observed performance while staying more trust-preserving than 40% off.
192	0.8096	0.8037	0.0000	0.0000	0.5574	0.8029	pass	discard	context_arms	[Lifecycle Strategist] [LLM] context graduating|free|downgrade_lite_switch alpha+=3, beta+=0 — Users signaling graduation are at a clear lifecycle transition where a lighter plan fits better than cancellation, and this context already shows the strongest observed save rate with enough signal to justify favoring it without adding trust risk.
193	0.8069	0.8041	-0.0027	0.0004	0.5546	0.8042	pass	discard	arm_priors	[Support Concierge] [LLM] concierge_recovery alpha+=4, beta+=0 — Concierge recovery is already a top-performing non-discount arm with strong strategy quality, so a modest alpha increase should route slightly more traffic to a trust-preserving save path without materially reducing exploration.
194	0.8096	0.8037	0.0000	0.0000	0.5574	0.8029	pass	discard	reason_routing	[Trust Guardian] [LLM] deny targeted_discount_40 for quality_bug — Block 40% discounts for quality_bug cancellations because offering a steep save on a product perceived as broken is trust-eroding and likely to produce low-quality saves while preserving room for non-manipulative recovery paths.
195	0.8096	0.8037	0.0000	0.0000	0.5574	0.8029	pass	discard	exploration_rate	[Experiment Operator] [LLM] exploration_rate 0.150 -> 0.050 — With only 300 resolved outcomes and several strong arms already showing large performance gaps over control, reducing exploration from 0.15 to 0.05 should concentrate traffic on proven non-discount options and improve save_rate while preserving trust.
196	0.8092	0.8037	-0.0004	-0.0000	0.5546	0.8030	pass	discard	context_arms	[Product Storyteller] [LLM] context feature_gap|free|feature_value_recap alpha+=3, beta+=0 — Users citing feature gaps on the free plan are the clearest fit for product-led value realization, and boosting feature_value_recap specifically in that context should redirect traffic away from a near-zero-win control without relying on discounts or trust-eroding pressure.
196	0.0000	0.0000	0.0000	0.0000	0.0000	0.0000	pass	keep	generation_round	generated pause_plan_relief:s865
196	0.0000	0.0000	0.0000	0.0000	0.0000	0.0000	pass	keep	generation_round	generated pause_plan_relief:s866
196	0.0000	0.0000	0.0000	0.0000	0.0000	0.0000	pass	keep	generation_round	generated pause_plan_relief:s867
196	0.0000	0.0000	0.0000	0.0000	0.0000	0.0000	pass	keep	generation_round	generated downgrade_lite_switch:s868
196	0.0000	0.0000	0.0000	0.0000	0.0000	0.0000	pass	keep	generation_round	generated downgrade_lite_switch:s869
196	0.0000	0.0000	0.0000	0.0000	0.0000	0.0000	pass	keep	generation_round	generated downgrade_lite_switch:s870
196	0.0000	0.0000	0.0000	0.0000	0.0000	0.0000	pass	keep	generation_round	generated targeted_discount_20:s871
196	0.0000	0.0000	0.0000	0.0000	0.0000	0.0000	pass	keep	generation_round	generated targeted_discount_20:s872
196	0.0000	0.0000	0.0000	0.0000	0.0000	0.0000	pass	keep	generation_round	generated targeted_discount_20:s873
196	0.0000	0.0000	0.0000	0.0000	0.0000	0.0000	pass	keep	generation_round	generated targeted_discount_40:s874
196	0.0000	0.0000	0.0000	0.0000	0.0000	0.0000	pass	keep	generation_round	generated targeted_discount_40:s875
196	0.0000	0.0000	0.0000	0.0000	0.0000	0.0000	pass	keep	generation_round	generated targeted_discount_40:s876
196	0.0000	0.0000	0.0000	0.0000	0.0000	0.0000	pass	keep	generation_round	generated concierge_recovery:s877
196	0.0000	0.0000	0.0000	0.0000	0.0000	0.0000	pass	keep	generation_round	generated concierge_recovery:s878
196	0.0000	0.0000	0.0000	0.0000	0.0000	0.0000	pass	keep	generation_round	generated concierge_recovery:s879
196	0.0000	0.0000	0.0000	0.0000	0.0000	0.0000	pass	keep	generation_round	generated exam_sprint_focus:s880
196	0.0000	0.0000	0.0000	0.0000	0.0000	0.0000	pass	keep	generation_round	generated exam_sprint_focus:s881
196	0.0000	0.0000	0.0000	0.0000	0.0000	0.0000	pass	keep	generation_round	generated exam_sprint_focus:s882
196	0.0000	0.0000	0.0000	0.0000	0.0000	0.0000	pass	keep	generation_round	generated feature_value_recap:s883
196	0.0000	0.0000	0.0000	0.0000	0.0000	0.0000	pass	keep	generation_round	generated feature_value_recap:s884
196	0.0000	0.0000	0.0000	0.0000	0.0000	0.0000	pass	keep	generation_round	generated feature_value_recap:s885
196	0.0000	0.0000	0.0000	0.0000	0.0000	0.0000	pass	keep	generation_round	generated billing_clarity_reset:s886
196	0.0000	0.0000	0.0000	0.0000	0.0000	0.0000	pass	keep	generation_round	generated billing_clarity_reset:s887
196	0.0000	0.0000	0.0000	0.0000	0.0000	0.0000	pass	keep	generation_round	generated billing_clarity_reset:s888
196	0.0000	0.0000	0.0000	0.0000	0.0000	0.0000	pass	keep	generation_round	generated control_empathic_exit:s889
196	0.0000	0.0000	0.0000	0.0000	0.0000	0.0000	pass	keep	generation_round	generated control_empathic_exit:s890
196	0.0000	0.0000	0.0000	0.0000	0.0000	0.0000	pass	keep	generation_round	generated control_empathic_exit:s891
196	0.0000	0.0000	0.0000	0.0000	0.0000	0.0000	pass	keep	generation_round	synced strategy_arms for pause_plan_relief (8 strategies)
196	0.0000	0.0000	0.0000	0.0000	0.0000	0.0000	pass	keep	generation_round	synced strategy_arms for downgrade_lite_switch (8 strategies)
196	0.0000	0.0000	0.0000	0.0000	0.0000	0.0000	pass	keep	generation_round	synced strategy_arms for targeted_discount_20 (8 strategies)
196	0.0000	0.0000	0.0000	0.0000	0.0000	0.0000	pass	keep	generation_round	synced strategy_arms for targeted_discount_40 (8 strategies)
196	0.0000	0.0000	0.0000	0.0000	0.0000	0.0000	pass	keep	generation_round	synced strategy_arms for concierge_recovery (8 strategies)
196	0.0000	0.0000	0.0000	0.0000	0.0000	0.0000	pass	keep	generation_round	synced strategy_arms for exam_sprint_focus (8 strategies)
196	0.0000	0.0000	0.0000	0.0000	0.0000	0.0000	pass	keep	generation_round	synced strategy_arms for feature_value_recap (8 strategies)
196	0.0000	0.0000	0.0000	0.0000	0.0000	0.0000	pass	keep	generation_round	synced strategy_arms for billing_clarity_reset (8 strategies)
196	0.0000	0.0000	0.0000	0.0000	0.0000	0.0000	pass	keep	generation_round	synced strategy_arms for control_empathic_exit (8 strategies)
196	0.0000	0.0000	0.0000	0.0000	0.0000	0.0000	pass	keep	generation_round	pruned pause_plan_relief: ['s867', 's866', 's865']
196	0.0000	0.0000	0.0000	0.0000	0.0000	0.0000	pass	keep	generation_round	pruned downgrade_lite_switch: ['s868', 's870', 's869']
196	0.0000	0.0000	0.0000	0.0000	0.0000	0.0000	pass	keep	generation_round	pruned targeted_discount_20: ['s36', 's872', 's873']
196	0.0000	0.0000	0.0000	0.0000	0.0000	0.0000	pass	keep	generation_round	pruned targeted_discount_40: ['s874', 's875', 's876']
196	0.0000	0.0000	0.0000	0.0000	0.0000	0.0000	pass	keep	generation_round	pruned concierge_recovery: ['s878', 's879', 's877']
196	0.0000	0.0000	0.0000	0.0000	0.0000	0.0000	pass	keep	generation_round	pruned exam_sprint_focus: ['s718', 's880', 's882']
196	0.0000	0.0000	0.0000	0.0000	0.0000	0.0000	pass	keep	generation_round	pruned feature_value_recap: ['s640', 's883', 's884']
196	0.0000	0.0000	0.0000	0.0000	0.0000	0.0000	pass	keep	generation_round	pruned billing_clarity_reset: ['s888', 's886', 's887']
196	0.0000	0.0000	0.0000	0.0000	0.0000	0.0000	pass	keep	generation_round	pruned control_empathic_exit: ['s890', 's889', 's891']
196	0.0000	0.0000	0.0000	0.0000	0.0000	0.0000	pass	keep	generation_round	generation 33 complete
197	0.8097	0.8038	0.0000	0.0000	0.5574	0.8038	pass	discard	context_arms	[Deadline Operator] [LLM] context graduating|free|exam_sprint_focus alpha+=3, beta+=0 — For exam-deadline users on free plans, increasing preference for exam_sprint_focus should capture high-urgency save intent in the next few days without adding discount pressure or reducing trust.
198	0.8097	0.8038	0.0000	0.0000	0.5574	0.8038	pass	discard	context_arms	[Win-Back Researcher] [LLM] context break|free|pause_plan_relief alpha+=3, beta+=0 — Dormant or fatigued users citing a break respond best to a low-pressure comeback path, and this context already shows strong early save performance for pause without adding trust risk.
199	0.8095	0.8023	-0.0002	-0.0015	0.5601	0.8043	pass	discard	arm_priors	[Retention Psychologist] [LLM] downgrade_lite_switch alpha+=3, beta+=0 — Favoring downgrade_lite_switch should improve saves by preserving learner identity and streak momentum with a lower-commitment path, which is habit-consistent and less trust-risky than pushing deeper discounts.
200	0.8097	0.8038	0.0000	0.0000	0.5574	0.8038	pass	discard	reason_routing	[Offer Economist] [LLM] deny targeted_discount_40 for feature_gap — Block 40% discounts for feature-gap cancels because the issue is product fit rather than price, preserving trust and LTV while shifting traffic toward strong non-discount saves like downgrade and feature-value paths.
