run_id	save_rate	average_reward	save_lift	reward_lift	alignment	trust	regression	status	mutation_type	description
160	0.0000	0.0000	0.0000	0.0000	0.0000	0.0000	pass	keep	generation_round	pruned targeted_discount_20: ['s684', 's682', 's683']
160	0.0000	0.0000	0.0000	0.0000	0.0000	0.0000	pass	keep	generation_round	pruned targeted_discount_40: ['s685', 's687', 's686']
160	0.0000	0.0000	0.0000	0.0000	0.0000	0.0000	pass	keep	generation_round	pruned concierge_recovery: ['s690', 's689', 's688']
160	0.0000	0.0000	0.0000	0.0000	0.0000	0.0000	pass	keep	generation_round	pruned exam_sprint_focus: ['s691', 's693', 's692']
160	0.0000	0.0000	0.0000	0.0000	0.0000	0.0000	pass	keep	generation_round	pruned feature_value_recap: ['s694', 's695', 's696']
160	0.0000	0.0000	0.0000	0.0000	0.0000	0.0000	pass	keep	generation_round	pruned billing_clarity_reset: ['s699', 's698', 's697']
160	0.0000	0.0000	0.0000	0.0000	0.0000	0.0000	pass	keep	generation_round	pruned control_empathic_exit: ['s431', 's377', 's700']
160	0.0000	0.0000	0.0000	0.0000	0.0000	0.0000	pass	keep	generation_round	generation 26 complete
161	0.8049	0.8009	0.0000	0.0000	0.5574	0.7634	pass	discard	context_arms	[Deadline Operator] [LLM] context graduating|free|exam_sprint_focus alpha+=3, beta+=0 — For deadline-driven graduating users on free plans, increasing preference for exam_sprint_focus should capture a high-leverage urgency window with a trust-safe, non-discount intervention.
162	0.8049	0.8009	0.0000	0.0000	0.5574	0.7634	pass	discard	context_arms	[Win-Back Researcher] [LLM] context break|free|pause_plan_relief alpha+=3, beta+=0 — Dormant or fatigued users citing a break are showing the clearest fit for a low-pressure comeback path, and strengthening this high-win context should lift saves without adding sales pressure or trust risk.
163	0.8049	0.8009	0.0000	0.0000	0.5574	0.7634	pass	discard	context_arms	[Retention Psychologist] [LLM] context break|free|pause_plan_relief alpha+=3, beta+=0 — Learners citing a break are highly receptive to preserving identity and streak momentum via a pause, and this context already shows strong early performance without requiring trust-eroding pressure or discounts.
164	0.8049	0.8009	0.0000	0.0000	0.5574	0.7634	pass	discard	discount_cap	[Offer Economist] [LLM] discount_cap 1 -> 0 — Discount arms have not shown a robust advantage over strong non-discount saves while prior discount boosts slightly hurt save lift, so temporarily setting the 30-day discount cap to zero should shift traffic to higher-efficiency non-discount actions and protect trust and LTV.
165	0.8049	0.8009	0.0000	0.0000	0.5574	0.7634	pass	discard	context_arms	[Lifecycle Strategist] [LLM] context break|free|pause_plan_relief alpha+=3, beta+=0 — Users signaling a temporary break are in a clear pause-friendly lifecycle stage, and reinforcing pause_plan_relief for break|free should raise saves by matching a reversible intervention to short-term churn intent without adding trust risk.
165	0.0000	0.0000	0.0000	0.0000	0.0000	0.0000	pass	keep	generation_round	generated pause_plan_relief:s703
165	0.0000	0.0000	0.0000	0.0000	0.0000	0.0000	pass	keep	generation_round	generated pause_plan_relief:s704
165	0.0000	0.0000	0.0000	0.0000	0.0000	0.0000	pass	keep	generation_round	generated pause_plan_relief:s705
165	0.0000	0.0000	0.0000	0.0000	0.0000	0.0000	pass	keep	generation_round	generated downgrade_lite_switch:s706
165	0.0000	0.0000	0.0000	0.0000	0.0000	0.0000	pass	keep	generation_round	generated downgrade_lite_switch:s707
165	0.0000	0.0000	0.0000	0.0000	0.0000	0.0000	pass	keep	generation_round	generated downgrade_lite_switch:s708
165	0.0000	0.0000	0.0000	0.0000	0.0000	0.0000	pass	keep	generation_round	generated targeted_discount_20:s709
165	0.0000	0.0000	0.0000	0.0000	0.0000	0.0000	pass	keep	generation_round	generated targeted_discount_20:s710
165	0.0000	0.0000	0.0000	0.0000	0.0000	0.0000	pass	keep	generation_round	generated targeted_discount_20:s711
165	0.0000	0.0000	0.0000	0.0000	0.0000	0.0000	pass	keep	generation_round	generated targeted_discount_40:s712
165	0.0000	0.0000	0.0000	0.0000	0.0000	0.0000	pass	keep	generation_round	generated targeted_discount_40:s713
165	0.0000	0.0000	0.0000	0.0000	0.0000	0.0000	pass	keep	generation_round	generated targeted_discount_40:s714
165	0.0000	0.0000	0.0000	0.0000	0.0000	0.0000	pass	keep	generation_round	generated concierge_recovery:s715
165	0.0000	0.0000	0.0000	0.0000	0.0000	0.0000	pass	keep	generation_round	generated concierge_recovery:s716
165	0.0000	0.0000	0.0000	0.0000	0.0000	0.0000	pass	keep	generation_round	generated concierge_recovery:s717
165	0.0000	0.0000	0.0000	0.0000	0.0000	0.0000	pass	keep	generation_round	generated exam_sprint_focus:s718
165	0.0000	0.0000	0.0000	0.0000	0.0000	0.0000	pass	keep	generation_round	generated exam_sprint_focus:s719
165	0.0000	0.0000	0.0000	0.0000	0.0000	0.0000	pass	keep	generation_round	generated exam_sprint_focus:s720
165	0.0000	0.0000	0.0000	0.0000	0.0000	0.0000	pass	keep	generation_round	generated feature_value_recap:s721
165	0.0000	0.0000	0.0000	0.0000	0.0000	0.0000	pass	keep	generation_round	generated feature_value_recap:s722
165	0.0000	0.0000	0.0000	0.0000	0.0000	0.0000	pass	keep	generation_round	generated feature_value_recap:s723
165	0.0000	0.0000	0.0000	0.0000	0.0000	0.0000	pass	keep	generation_round	generated billing_clarity_reset:s724
165	0.0000	0.0000	0.0000	0.0000	0.0000	0.0000	pass	keep	generation_round	generated billing_clarity_reset:s725
165	0.0000	0.0000	0.0000	0.0000	0.0000	0.0000	pass	keep	generation_round	generated billing_clarity_reset:s726
165	0.0000	0.0000	0.0000	0.0000	0.0000	0.0000	pass	keep	generation_round	generated control_empathic_exit:s727
165	0.0000	0.0000	0.0000	0.0000	0.0000	0.0000	pass	keep	generation_round	generated control_empathic_exit:s728
165	0.0000	0.0000	0.0000	0.0000	0.0000	0.0000	pass	keep	generation_round	generated control_empathic_exit:s729
165	0.0000	0.0000	0.0000	0.0000	0.0000	0.0000	pass	keep	generation_round	synced strategy_arms for pause_plan_relief (8 strategies)
165	0.0000	0.0000	0.0000	0.0000	0.0000	0.0000	pass	keep	generation_round	synced strategy_arms for downgrade_lite_switch (8 strategies)
165	0.0000	0.0000	0.0000	0.0000	0.0000	0.0000	pass	keep	generation_round	synced strategy_arms for targeted_discount_20 (8 strategies)
165	0.0000	0.0000	0.0000	0.0000	0.0000	0.0000	pass	keep	generation_round	synced strategy_arms for targeted_discount_40 (8 strategies)
165	0.0000	0.0000	0.0000	0.0000	0.0000	0.0000	pass	keep	generation_round	synced strategy_arms for concierge_recovery (8 strategies)
165	0.0000	0.0000	0.0000	0.0000	0.0000	0.0000	pass	keep	generation_round	synced strategy_arms for exam_sprint_focus (8 strategies)
165	0.0000	0.0000	0.0000	0.0000	0.0000	0.0000	pass	keep	generation_round	synced strategy_arms for feature_value_recap (8 strategies)
165	0.0000	0.0000	0.0000	0.0000	0.0000	0.0000	pass	keep	generation_round	synced strategy_arms for billing_clarity_reset (8 strategies)
165	0.0000	0.0000	0.0000	0.0000	0.0000	0.0000	pass	keep	generation_round	synced strategy_arms for control_empathic_exit (8 strategies)
165	0.0000	0.0000	0.0000	0.0000	0.0000	0.0000	pass	keep	generation_round	pruned pause_plan_relief: ['s433', 's704', 's705']
165	0.0000	0.0000	0.0000	0.0000	0.0000	0.0000	pass	keep	generation_round	pruned downgrade_lite_switch: ['s706', 's708', 's707']
165	0.0000	0.0000	0.0000	0.0000	0.0000	0.0000	pass	keep	generation_round	pruned targeted_discount_20: ['s710', 's711', 's709']
165	0.0000	0.0000	0.0000	0.0000	0.0000	0.0000	pass	keep	generation_round	pruned targeted_discount_40: ['s713', 's712', 's714']
165	0.0000	0.0000	0.0000	0.0000	0.0000	0.0000	pass	keep	generation_round	pruned concierge_recovery: ['s715', 's716', 's717']
165	0.0000	0.0000	0.0000	0.0000	0.0000	0.0000	pass	keep	generation_round	pruned exam_sprint_focus: ['s639', 's720', 's719']
165	0.0000	0.0000	0.0000	0.0000	0.0000	0.0000	pass	keep	generation_round	pruned feature_value_recap: ['s723', 's721', 's722']
165	0.0000	0.0000	0.0000	0.0000	0.0000	0.0000	pass	keep	generation_round	pruned billing_clarity_reset: ['s726', 's725', 's724']
165	0.0000	0.0000	0.0000	0.0000	0.0000	0.0000	pass	keep	generation_round	pruned control_empathic_exit: ['s727', 's728', 's729']
165	0.0000	0.0000	0.0000	0.0000	0.0000	0.0000	pass	keep	generation_round	generation 27 complete
166	0.8049	0.8009	0.0000	0.0000	0.5574	0.7634	pass	discard	exploration_rate	[Support Concierge] [LLM] exploration_rate 0.150 -> 0.080 — Lowering exploration from 0.15 to 0.08 should route more traffic to stronger non-discount arms like concierge_recovery while preserving enough exploration to keep learning without overexposing users to weaker experiences.
167	0.8049	0.8009	0.0000	0.0000	0.5574	0.7634	pass	discard	reason_routing	[Trust Guardian] [LLM] deny concierge_recovery for quality_bug — Users canceling for product quality issues are unlikely to trust a human save intervention, so blocking concierge_recovery there should steer traffic toward less manipulative resolution paths without hurting saves.
168	0.8049	0.8009	0.0000	0.0000	0.5574	0.7634	pass	discard	exploration_rate	[Experiment Operator] [LLM] exploration_rate 0.150 -> 0.050 — With only 300 resolved outcomes and several clearly superior non-control arms already identified, reducing exploration to 5% should concentrate traffic on proven winners faster while still preserving enough learning to avoid trust-harming overcommitment.
169	0.8037	0.8011	-0.0012	0.0002	0.5519	0.7637	pass	discard	arm_priors	[Product Storyteller] [LLM] feature_value_recap alpha+=3, beta+=0 — Feature_value_recap already shows strong global performance and directly aligns with value-realization saves, so a modest prior boost should route more users toward an earned product-led save path without reducing trust.
170	0.8049	0.8009	0.0000	0.0000	0.5574	0.7634	pass	discard	context_arms	[Deadline Operator] [LLM] context graduating|free|exam_sprint_focus alpha+=3, beta+=0 — For exam/goal-driven users facing an imminent deadline, increasing preference for exam_sprint_focus in the graduating|free context should raise saves by matching urgency with a credible short-term retention action without reducing trust.
170	0.0000	0.0000	0.0000	0.0000	0.0000	0.0000	pass	keep	generation_round	generated pause_plan_relief:s730
170	0.0000	0.0000	0.0000	0.0000	0.0000	0.0000	pass	keep	generation_round	generated pause_plan_relief:s731
170	0.0000	0.0000	0.0000	0.0000	0.0000	0.0000	pass	keep	generation_round	generated pause_plan_relief:s732
170	0.0000	0.0000	0.0000	0.0000	0.0000	0.0000	pass	keep	generation_round	generated downgrade_lite_switch:s733
170	0.0000	0.0000	0.0000	0.0000	0.0000	0.0000	pass	keep	generation_round	generated downgrade_lite_switch:s734
170	0.0000	0.0000	0.0000	0.0000	0.0000	0.0000	pass	keep	generation_round	generated downgrade_lite_switch:s735
170	0.0000	0.0000	0.0000	0.0000	0.0000	0.0000	pass	keep	generation_round	generated targeted_discount_20:s736
170	0.0000	0.0000	0.0000	0.0000	0.0000	0.0000	pass	keep	generation_round	generated targeted_discount_20:s737
170	0.0000	0.0000	0.0000	0.0000	0.0000	0.0000	pass	keep	generation_round	generated targeted_discount_20:s738
170	0.0000	0.0000	0.0000	0.0000	0.0000	0.0000	pass	keep	generation_round	generated targeted_discount_40:s739
170	0.0000	0.0000	0.0000	0.0000	0.0000	0.0000	pass	keep	generation_round	generated targeted_discount_40:s740
170	0.0000	0.0000	0.0000	0.0000	0.0000	0.0000	pass	keep	generation_round	generated targeted_discount_40:s741
170	0.0000	0.0000	0.0000	0.0000	0.0000	0.0000	pass	keep	generation_round	generated concierge_recovery:s742
170	0.0000	0.0000	0.0000	0.0000	0.0000	0.0000	pass	keep	generation_round	generated concierge_recovery:s743
170	0.0000	0.0000	0.0000	0.0000	0.0000	0.0000	pass	keep	generation_round	generated concierge_recovery:s744
170	0.0000	0.0000	0.0000	0.0000	0.0000	0.0000	pass	keep	generation_round	generated exam_sprint_focus:s745
170	0.0000	0.0000	0.0000	0.0000	0.0000	0.0000	pass	keep	generation_round	generated exam_sprint_focus:s746
170	0.0000	0.0000	0.0000	0.0000	0.0000	0.0000	pass	keep	generation_round	generated exam_sprint_focus:s747
170	0.0000	0.0000	0.0000	0.0000	0.0000	0.0000	pass	keep	generation_round	generated feature_value_recap:s748
170	0.0000	0.0000	0.0000	0.0000	0.0000	0.0000	pass	keep	generation_round	generated feature_value_recap:s749
170	0.0000	0.0000	0.0000	0.0000	0.0000	0.0000	pass	keep	generation_round	generated feature_value_recap:s750
170	0.0000	0.0000	0.0000	0.0000	0.0000	0.0000	pass	keep	generation_round	generated billing_clarity_reset:s751
170	0.0000	0.0000	0.0000	0.0000	0.0000	0.0000	pass	keep	generation_round	generated billing_clarity_reset:s752
170	0.0000	0.0000	0.0000	0.0000	0.0000	0.0000	pass	keep	generation_round	generated billing_clarity_reset:s753
170	0.0000	0.0000	0.0000	0.0000	0.0000	0.0000	pass	keep	generation_round	generated control_empathic_exit:s754
170	0.0000	0.0000	0.0000	0.0000	0.0000	0.0000	pass	keep	generation_round	generated control_empathic_exit:s755
170	0.0000	0.0000	0.0000	0.0000	0.0000	0.0000	pass	keep	generation_round	generated control_empathic_exit:s756
170	0.0000	0.0000	0.0000	0.0000	0.0000	0.0000	pass	keep	generation_round	synced strategy_arms for pause_plan_relief (8 strategies)
170	0.0000	0.0000	0.0000	0.0000	0.0000	0.0000	pass	keep	generation_round	synced strategy_arms for downgrade_lite_switch (8 strategies)
170	0.0000	0.0000	0.0000	0.0000	0.0000	0.0000	pass	keep	generation_round	synced strategy_arms for targeted_discount_20 (8 strategies)
170	0.0000	0.0000	0.0000	0.0000	0.0000	0.0000	pass	keep	generation_round	synced strategy_arms for targeted_discount_40 (8 strategies)
170	0.0000	0.0000	0.0000	0.0000	0.0000	0.0000	pass	keep	generation_round	synced strategy_arms for concierge_recovery (8 strategies)
170	0.0000	0.0000	0.0000	0.0000	0.0000	0.0000	pass	keep	generation_round	synced strategy_arms for exam_sprint_focus (8 strategies)
170	0.0000	0.0000	0.0000	0.0000	0.0000	0.0000	pass	keep	generation_round	synced strategy_arms for feature_value_recap (8 strategies)
170	0.0000	0.0000	0.0000	0.0000	0.0000	0.0000	pass	keep	generation_round	synced strategy_arms for billing_clarity_reset (8 strategies)
170	0.0000	0.0000	0.0000	0.0000	0.0000	0.0000	pass	keep	generation_round	synced strategy_arms for control_empathic_exit (8 strategies)
170	0.0000	0.0000	0.0000	0.0000	0.0000	0.0000	pass	keep	generation_round	pruned pause_plan_relief: ['s732', 's730', 's731']
170	0.0000	0.0000	0.0000	0.0000	0.0000	0.0000	pass	keep	generation_round	pruned downgrade_lite_switch: ['s733', 's734', 's735']
170	0.0000	0.0000	0.0000	0.0000	0.0000	0.0000	pass	keep	generation_round	pruned targeted_discount_20: ['s736', 's737', 's738']
170	0.0000	0.0000	0.0000	0.0000	0.0000	0.0000	pass	keep	generation_round	pruned targeted_discount_40: ['s739', 's740', 's741']
170	0.0000	0.0000	0.0000	0.0000	0.0000	0.0000	pass	keep	generation_round	pruned concierge_recovery: ['s744', 's742', 's743']
170	0.0000	0.0000	0.0000	0.0000	0.0000	0.0000	pass	keep	generation_round	pruned exam_sprint_focus: ['s745', 's747', 's746']
170	0.0000	0.0000	0.0000	0.0000	0.0000	0.0000	pass	keep	generation_round	pruned feature_value_recap: ['s156', 's749', 's750']
170	0.0000	0.0000	0.0000	0.0000	0.0000	0.0000	pass	keep	generation_round	pruned billing_clarity_reset: ['s751', 's752', 's753']
170	0.0000	0.0000	0.0000	0.0000	0.0000	0.0000	pass	keep	generation_round	pruned control_empathic_exit: ['s756', 's755', 's754']
170	0.0000	0.0000	0.0000	0.0000	0.0000	0.0000	pass	keep	generation_round	generation 28 complete
171	0.8046	0.8009	-0.0003	0.0000	0.5546	0.7636	pass	discard	context_arms	[Win-Back Researcher] [LLM] context other|free|concierge_recovery alpha+=3, beta+=0 — Dormant or fatigued users often cancel under vague 'other' reasons, and the perfect early performance for free-plan users on concierge_recovery suggests we should more strongly favor a low-pressure comeback path in that context without adding sales pressure.
172	0.8021	0.7985	-0.0028	-0.0024	0.5683	0.7636	pass	discard	arm_priors	[Retention Psychologist] [LLM] pause_plan_relief alpha+=4, beta+=0 — Favoring pause_plan_relief should improve saves by catching habit-driven learners with a low-trust, momentum-preserving alternative before they fully rationalize cancellation.
173	0.8048	0.8015	-0.0001	0.0006	0.5656	0.7623	pass	discard	arm_priors	[Offer Economist] [LLM] targeted_discount_20 alpha+=4, beta+=0 — Favoring targeted_discount_20 over deeper discounting should move traffic toward a strong-performing, lower-cost save option on the discount frontier, improving saves while preserving trust and LTV.
174	0.8049	0.8009	0.0000	0.0000	0.5574	0.7634	pass	discard	context_arms	[Lifecycle Strategist] [LLM] context graduating|free|downgrade_lite_switch alpha+=3, beta+=0 — Users signaling graduation are in a clear lifecycle transition where a lighter plan matches reduced future need better than pause or discounts, and this context already shows the strongest observed save rate.
175	0.8023	0.8013	-0.0027	0.0004	0.5546	0.7647	pass	discard	arm_priors	[Support Concierge] [LLM] concierge_recovery alpha+=4, beta+=0 — Concierge_recovery is already a top-performing non-discount arm with strong strategy quality, so a modest alpha increase should route slightly more eligible users into warm human handoff without adding trust risk.
175	0.0000	0.0000	0.0000	0.0000	0.0000	0.0000	pass	keep	generation_round	generated pause_plan_relief:s757
175	0.0000	0.0000	0.0000	0.0000	0.0000	0.0000	pass	keep	generation_round	generated pause_plan_relief:s758
175	0.0000	0.0000	0.0000	0.0000	0.0000	0.0000	pass	keep	generation_round	generated pause_plan_relief:s759
175	0.0000	0.0000	0.0000	0.0000	0.0000	0.0000	pass	keep	generation_round	generated downgrade_lite_switch:s760
175	0.0000	0.0000	0.0000	0.0000	0.0000	0.0000	pass	keep	generation_round	generated downgrade_lite_switch:s761
175	0.0000	0.0000	0.0000	0.0000	0.0000	0.0000	pass	keep	generation_round	generated downgrade_lite_switch:s762
175	0.0000	0.0000	0.0000	0.0000	0.0000	0.0000	pass	keep	generation_round	generated targeted_discount_20:s763
175	0.0000	0.0000	0.0000	0.0000	0.0000	0.0000	pass	keep	generation_round	generated targeted_discount_20:s764
175	0.0000	0.0000	0.0000	0.0000	0.0000	0.0000	pass	keep	generation_round	generated targeted_discount_20:s765
175	0.0000	0.0000	0.0000	0.0000	0.0000	0.0000	pass	keep	generation_round	generated targeted_discount_40:s766
175	0.0000	0.0000	0.0000	0.0000	0.0000	0.0000	pass	keep	generation_round	generated targeted_discount_40:s767
175	0.0000	0.0000	0.0000	0.0000	0.0000	0.0000	pass	keep	generation_round	generated targeted_discount_40:s768
175	0.0000	0.0000	0.0000	0.0000	0.0000	0.0000	pass	keep	generation_round	generated concierge_recovery:s769
175	0.0000	0.0000	0.0000	0.0000	0.0000	0.0000	pass	keep	generation_round	generated concierge_recovery:s770
175	0.0000	0.0000	0.0000	0.0000	0.0000	0.0000	pass	keep	generation_round	generated concierge_recovery:s771
175	0.0000	0.0000	0.0000	0.0000	0.0000	0.0000	pass	keep	generation_round	generated exam_sprint_focus:s772
175	0.0000	0.0000	0.0000	0.0000	0.0000	0.0000	pass	keep	generation_round	generated exam_sprint_focus:s773
175	0.0000	0.0000	0.0000	0.0000	0.0000	0.0000	pass	keep	generation_round	generated exam_sprint_focus:s774
175	0.0000	0.0000	0.0000	0.0000	0.0000	0.0000	pass	keep	generation_round	generated feature_value_recap:s775
175	0.0000	0.0000	0.0000	0.0000	0.0000	0.0000	pass	keep	generation_round	generated feature_value_recap:s776
175	0.0000	0.0000	0.0000	0.0000	0.0000	0.0000	pass	keep	generation_round	generated feature_value_recap:s777
175	0.0000	0.0000	0.0000	0.0000	0.0000	0.0000	pass	keep	generation_round	generated billing_clarity_reset:s778
175	0.0000	0.0000	0.0000	0.0000	0.0000	0.0000	pass	keep	generation_round	generated billing_clarity_reset:s779
175	0.0000	0.0000	0.0000	0.0000	0.0000	0.0000	pass	keep	generation_round	generated billing_clarity_reset:s780
175	0.0000	0.0000	0.0000	0.0000	0.0000	0.0000	pass	keep	generation_round	generated control_empathic_exit:s781
175	0.0000	0.0000	0.0000	0.0000	0.0000	0.0000	pass	keep	generation_round	generated control_empathic_exit:s782
175	0.0000	0.0000	0.0000	0.0000	0.0000	0.0000	pass	keep	generation_round	generated control_empathic_exit:s783
175	0.0000	0.0000	0.0000	0.0000	0.0000	0.0000	pass	keep	generation_round	synced strategy_arms for pause_plan_relief (8 strategies)
175	0.0000	0.0000	0.0000	0.0000	0.0000	0.0000	pass	keep	generation_round	synced strategy_arms for downgrade_lite_switch (8 strategies)
175	0.0000	0.0000	0.0000	0.0000	0.0000	0.0000	pass	keep	generation_round	synced strategy_arms for targeted_discount_20 (8 strategies)
175	0.0000	0.0000	0.0000	0.0000	0.0000	0.0000	pass	keep	generation_round	synced strategy_arms for targeted_discount_40 (8 strategies)
175	0.0000	0.0000	0.0000	0.0000	0.0000	0.0000	pass	keep	generation_round	synced strategy_arms for concierge_recovery (8 strategies)
175	0.0000	0.0000	0.0000	0.0000	0.0000	0.0000	pass	keep	generation_round	synced strategy_arms for exam_sprint_focus (8 strategies)
175	0.0000	0.0000	0.0000	0.0000	0.0000	0.0000	pass	keep	generation_round	synced strategy_arms for feature_value_recap (8 strategies)
175	0.0000	0.0000	0.0000	0.0000	0.0000	0.0000	pass	keep	generation_round	synced strategy_arms for billing_clarity_reset (8 strategies)
175	0.0000	0.0000	0.0000	0.0000	0.0000	0.0000	pass	keep	generation_round	synced strategy_arms for control_empathic_exit (8 strategies)
175	0.0000	0.0000	0.0000	0.0000	0.0000	0.0000	pass	keep	generation_round	pruned pause_plan_relief: ['s759', 's757', 's758']
175	0.0000	0.0000	0.0000	0.0000	0.0000	0.0000	pass	keep	generation_round	pruned downgrade_lite_switch: ['s762', 's760', 's761']
175	0.0000	0.0000	0.0000	0.0000	0.0000	0.0000	pass	keep	generation_round	pruned targeted_discount_20: ['s763', 's764', 's765']
175	0.0000	0.0000	0.0000	0.0000	0.0000	0.0000	pass	keep	generation_round	pruned targeted_discount_40: ['s767', 's766', 's768']
