run_id	save_rate	average_reward	save_lift	reward_lift	alignment	trust	regression	status	mutation_type	description
145	0.0000	0.0000	0.0000	0.0000	0.0000	0.0000	pass	keep	generation_round	pruned downgrade_lite_switch: ['s329', 's598', 's599']
145	0.0000	0.0000	0.0000	0.0000	0.0000	0.0000	pass	keep	generation_round	pruned targeted_discount_20: ['s61', 's603', 's601']
145	0.0000	0.0000	0.0000	0.0000	0.0000	0.0000	pass	keep	generation_round	pruned targeted_discount_40: ['s606', 's604', 's605']
145	0.0000	0.0000	0.0000	0.0000	0.0000	0.0000	pass	keep	generation_round	pruned concierge_recovery: ['s607', 's608', 's609']
145	0.0000	0.0000	0.0000	0.0000	0.0000	0.0000	pass	keep	generation_round	pruned exam_sprint_focus: ['s612', 's610', 's611']
145	0.0000	0.0000	0.0000	0.0000	0.0000	0.0000	pass	keep	generation_round	pruned feature_value_recap: ['s615', 's613', 's614']
145	0.0000	0.0000	0.0000	0.0000	0.0000	0.0000	pass	keep	generation_round	pruned billing_clarity_reset: ['s618', 's617', 's616']
145	0.0000	0.0000	0.0000	0.0000	0.0000	0.0000	pass	keep	generation_round	pruned control_empathic_exit: ['s620', 's619', 's621']
145	0.0000	0.0000	0.0000	0.0000	0.0000	0.0000	pass	keep	generation_round	generation 23 complete
146	0.8047	0.8008	0.0000	0.0000	0.5574	0.7639	pass	discard	discount_cap	[Offer Economist] [LLM] discount_cap 1 -> 0 — Non-discount saves already outperform control strongly while prior discount boosts have recently hurt lift, so setting the 30-day discount cap to zero should force traffic onto the more efficient frontier of pause/downgrade/concierge options and protect trust and LTV.
147	0.8047	0.8008	0.0000	0.0000	0.5574	0.7639	pass	discard	context_arms	[Lifecycle Strategist] [LLM] context break|free|pause_plan_relief alpha+=3, beta+=0 — Users signaling a temporary break are in a reversible lifecycle stage, and strengthening pause_plan_relief for free-plan break cancellations builds on the strongest lifecycle-matched context signal observed so far without introducing trust risk.
148	0.8047	0.8008	0.0000	0.0000	0.5574	0.7639	pass	discard	context_arms	[Support Concierge] [LLM] context price|free|concierge_recovery alpha+=3, beta+=0 — Boosting concierge_recovery specifically for price-sensitive free users leans into a high-trust, high-performing handoff path (0.6 win rate in-context) without broadly overexposing support-heavy routing.
149	0.8047	0.8008	0.0000	0.0000	0.5574	0.7639	pass	discard	reason_routing	[Trust Guardian] [LLM] deny targeted_discount_40 for feature_gap — Blocking the deepest discount for feature-gap cancellations avoids a trust-eroding mismatch where price is used to paper over product shortcomings, steering users toward more credible non-manipulative saves.
150	0.8047	0.8008	0.0000	0.0000	0.5574	0.7639	pass	discard	exploration_rate	[Experiment Operator] [LLM] exploration_rate 0.150 -> 0.060 — With only 300 resolved outcomes and several clearly dominant non-discount arms already identified, reducing exploration from 0.15 to 0.06 should shift more traffic to higher-performing options and improve save_rate without increasing trust risk.
150	0.0000	0.0000	0.0000	0.0000	0.0000	0.0000	pass	keep	generation_round	generated pause_plan_relief:s622
150	0.0000	0.0000	0.0000	0.0000	0.0000	0.0000	pass	keep	generation_round	generated pause_plan_relief:s623
150	0.0000	0.0000	0.0000	0.0000	0.0000	0.0000	pass	keep	generation_round	generated pause_plan_relief:s624
150	0.0000	0.0000	0.0000	0.0000	0.0000	0.0000	pass	keep	generation_round	generated downgrade_lite_switch:s625
150	0.0000	0.0000	0.0000	0.0000	0.0000	0.0000	pass	keep	generation_round	generated downgrade_lite_switch:s626
150	0.0000	0.0000	0.0000	0.0000	0.0000	0.0000	pass	keep	generation_round	generated downgrade_lite_switch:s627
150	0.0000	0.0000	0.0000	0.0000	0.0000	0.0000	pass	keep	generation_round	generated targeted_discount_20:s628
150	0.0000	0.0000	0.0000	0.0000	0.0000	0.0000	pass	keep	generation_round	generated targeted_discount_20:s629
150	0.0000	0.0000	0.0000	0.0000	0.0000	0.0000	pass	keep	generation_round	generated targeted_discount_20:s630
150	0.0000	0.0000	0.0000	0.0000	0.0000	0.0000	pass	keep	generation_round	generated targeted_discount_40:s631
150	0.0000	0.0000	0.0000	0.0000	0.0000	0.0000	pass	keep	generation_round	generated targeted_discount_40:s632
150	0.0000	0.0000	0.0000	0.0000	0.0000	0.0000	pass	keep	generation_round	generated targeted_discount_40:s633
150	0.0000	0.0000	0.0000	0.0000	0.0000	0.0000	pass	keep	generation_round	generated concierge_recovery:s634
150	0.0000	0.0000	0.0000	0.0000	0.0000	0.0000	pass	keep	generation_round	generated concierge_recovery:s635
150	0.0000	0.0000	0.0000	0.0000	0.0000	0.0000	pass	keep	generation_round	generated concierge_recovery:s636
150	0.0000	0.0000	0.0000	0.0000	0.0000	0.0000	pass	keep	generation_round	generated exam_sprint_focus:s637
150	0.0000	0.0000	0.0000	0.0000	0.0000	0.0000	pass	keep	generation_round	generated exam_sprint_focus:s638
150	0.0000	0.0000	0.0000	0.0000	0.0000	0.0000	pass	keep	generation_round	generated exam_sprint_focus:s639
150	0.0000	0.0000	0.0000	0.0000	0.0000	0.0000	pass	keep	generation_round	generated feature_value_recap:s640
150	0.0000	0.0000	0.0000	0.0000	0.0000	0.0000	pass	keep	generation_round	generated feature_value_recap:s641
150	0.0000	0.0000	0.0000	0.0000	0.0000	0.0000	pass	keep	generation_round	generated feature_value_recap:s642
150	0.0000	0.0000	0.0000	0.0000	0.0000	0.0000	pass	keep	generation_round	generated billing_clarity_reset:s643
150	0.0000	0.0000	0.0000	0.0000	0.0000	0.0000	pass	keep	generation_round	generated billing_clarity_reset:s644
150	0.0000	0.0000	0.0000	0.0000	0.0000	0.0000	pass	keep	generation_round	generated billing_clarity_reset:s645
150	0.0000	0.0000	0.0000	0.0000	0.0000	0.0000	pass	keep	generation_round	generated control_empathic_exit:s646
150	0.0000	0.0000	0.0000	0.0000	0.0000	0.0000	pass	keep	generation_round	generated control_empathic_exit:s647
150	0.0000	0.0000	0.0000	0.0000	0.0000	0.0000	pass	keep	generation_round	generated control_empathic_exit:s648
150	0.0000	0.0000	0.0000	0.0000	0.0000	0.0000	pass	keep	generation_round	synced strategy_arms for pause_plan_relief (8 strategies)
150	0.0000	0.0000	0.0000	0.0000	0.0000	0.0000	pass	keep	generation_round	synced strategy_arms for downgrade_lite_switch (8 strategies)
150	0.0000	0.0000	0.0000	0.0000	0.0000	0.0000	pass	keep	generation_round	synced strategy_arms for targeted_discount_20 (8 strategies)
150	0.0000	0.0000	0.0000	0.0000	0.0000	0.0000	pass	keep	generation_round	synced strategy_arms for targeted_discount_40 (8 strategies)
150	0.0000	0.0000	0.0000	0.0000	0.0000	0.0000	pass	keep	generation_round	synced strategy_arms for concierge_recovery (8 strategies)
150	0.0000	0.0000	0.0000	0.0000	0.0000	0.0000	pass	keep	generation_round	synced strategy_arms for exam_sprint_focus (8 strategies)
150	0.0000	0.0000	0.0000	0.0000	0.0000	0.0000	pass	keep	generation_round	synced strategy_arms for feature_value_recap (8 strategies)
150	0.0000	0.0000	0.0000	0.0000	0.0000	0.0000	pass	keep	generation_round	synced strategy_arms for billing_clarity_reset (8 strategies)
150	0.0000	0.0000	0.0000	0.0000	0.0000	0.0000	pass	keep	generation_round	synced strategy_arms for control_empathic_exit (8 strategies)
150	0.0000	0.0000	0.0000	0.0000	0.0000	0.0000	pass	keep	generation_round	pruned pause_plan_relief: ['s622', 's623', 's624']
150	0.0000	0.0000	0.0000	0.0000	0.0000	0.0000	pass	keep	generation_round	pruned downgrade_lite_switch: ['s626', 's627', 's625']
150	0.0000	0.0000	0.0000	0.0000	0.0000	0.0000	pass	keep	generation_round	pruned targeted_discount_20: ['s630', 's628', 's629']
150	0.0000	0.0000	0.0000	0.0000	0.0000	0.0000	pass	keep	generation_round	pruned targeted_discount_40: ['s631', 's633', 's632']
150	0.0000	0.0000	0.0000	0.0000	0.0000	0.0000	pass	keep	generation_round	pruned concierge_recovery: ['s634', 's636', 's635']
150	0.0000	0.0000	0.0000	0.0000	0.0000	0.0000	pass	keep	generation_round	pruned exam_sprint_focus: ['s638', 's44', 's637']
150	0.0000	0.0000	0.0000	0.0000	0.0000	0.0000	pass	keep	generation_round	pruned feature_value_recap: ['s20', 's641', 's642']
150	0.0000	0.0000	0.0000	0.0000	0.0000	0.0000	pass	keep	generation_round	pruned billing_clarity_reset: ['s644', 's643', 's645']
150	0.0000	0.0000	0.0000	0.0000	0.0000	0.0000	pass	keep	generation_round	pruned control_empathic_exit: ['s646', 's647', 's648']
150	0.0000	0.0000	0.0000	0.0000	0.0000	0.0000	pass	keep	generation_round	generation 24 complete
151	0.8043	0.8008	-0.0004	-0.0000	0.5546	0.7642	pass	discard	context_arms	[Product Storyteller] [LLM] context feature_gap|free|feature_value_recap alpha+=3, beta+=0 — Users canceling for feature_gap on free plans are currently over-routed to a near-zero-performing control, so boosting feature_value_recap in this context should surface already-created product value and improve saves without relying on discounting.
152	0.8047	0.8008	0.0000	0.0000	0.5574	0.7639	pass	discard	context_arms	[Deadline Operator] [LLM] context graduating|free|exam_sprint_focus alpha+=3, beta+=0 — For users facing a near-term graduation deadline, boosting exam_sprint_focus in this specific context should increase saves by favoring a high-intent, urgency-matched action without broadening pressure or reducing trust.
153	0.8044	0.8008	-0.0003	0.0000	0.5546	0.7642	pass	discard	context_arms	[Win-Back Researcher] [LLM] context other|free|concierge_recovery alpha+=3, beta+=0 — Dormant or fatigued free users in the broad 'other' bucket are already showing strong response to concierge_recovery, so modestly favoring this low-pressure re-engagement path should lift saves without undermining trust.
154	0.8047	0.8008	0.0000	0.0000	0.5574	0.7639	pass	discard	context_arms	[Retention Psychologist] [LLM] context graduating|free|downgrade_lite_switch alpha+=3, beta+=0 — Graduating users on free plans are already showing very strong response to downgrade_lite_switch, and reinforcing this habit-preserving, identity-consistent save path should lift saves without introducing manipulative pressure.
155	0.8044	0.8011	-0.0003	0.0003	0.5628	0.7625	pass	discard	arm_priors	[Offer Economist] [LLM] targeted_discount_20 alpha+=3, beta+=0 — A modest prior boost to targeted_discount_20 should shift discount traffic toward the more LTV-efficient lower discount arm, which already shows strong performance and is less likely than 40% off to erode trust or margin.
155	0.0000	0.0000	0.0000	0.0000	0.0000	0.0000	pass	keep	generation_round	generated pause_plan_relief:s649
155	0.0000	0.0000	0.0000	0.0000	0.0000	0.0000	pass	keep	generation_round	generated pause_plan_relief:s650
155	0.0000	0.0000	0.0000	0.0000	0.0000	0.0000	pass	keep	generation_round	generated pause_plan_relief:s651
155	0.0000	0.0000	0.0000	0.0000	0.0000	0.0000	pass	keep	generation_round	generated downgrade_lite_switch:s652
155	0.0000	0.0000	0.0000	0.0000	0.0000	0.0000	pass	keep	generation_round	generated downgrade_lite_switch:s653
155	0.0000	0.0000	0.0000	0.0000	0.0000	0.0000	pass	keep	generation_round	generated downgrade_lite_switch:s654
155	0.0000	0.0000	0.0000	0.0000	0.0000	0.0000	pass	keep	generation_round	generated targeted_discount_20:s655
155	0.0000	0.0000	0.0000	0.0000	0.0000	0.0000	pass	keep	generation_round	generated targeted_discount_20:s656
155	0.0000	0.0000	0.0000	0.0000	0.0000	0.0000	pass	keep	generation_round	generated targeted_discount_20:s657
155	0.0000	0.0000	0.0000	0.0000	0.0000	0.0000	pass	keep	generation_round	generated targeted_discount_40:s658
155	0.0000	0.0000	0.0000	0.0000	0.0000	0.0000	pass	keep	generation_round	generated targeted_discount_40:s659
155	0.0000	0.0000	0.0000	0.0000	0.0000	0.0000	pass	keep	generation_round	generated targeted_discount_40:s660
155	0.0000	0.0000	0.0000	0.0000	0.0000	0.0000	pass	keep	generation_round	generated concierge_recovery:s661
155	0.0000	0.0000	0.0000	0.0000	0.0000	0.0000	pass	keep	generation_round	generated concierge_recovery:s662
155	0.0000	0.0000	0.0000	0.0000	0.0000	0.0000	pass	keep	generation_round	generated concierge_recovery:s663
155	0.0000	0.0000	0.0000	0.0000	0.0000	0.0000	pass	keep	generation_round	generated exam_sprint_focus:s664
155	0.0000	0.0000	0.0000	0.0000	0.0000	0.0000	pass	keep	generation_round	generated exam_sprint_focus:s665
155	0.0000	0.0000	0.0000	0.0000	0.0000	0.0000	pass	keep	generation_round	generated exam_sprint_focus:s666
155	0.0000	0.0000	0.0000	0.0000	0.0000	0.0000	pass	keep	generation_round	generated feature_value_recap:s667
155	0.0000	0.0000	0.0000	0.0000	0.0000	0.0000	pass	keep	generation_round	generated feature_value_recap:s668
155	0.0000	0.0000	0.0000	0.0000	0.0000	0.0000	pass	keep	generation_round	generated feature_value_recap:s669
155	0.0000	0.0000	0.0000	0.0000	0.0000	0.0000	pass	keep	generation_round	generated billing_clarity_reset:s670
155	0.0000	0.0000	0.0000	0.0000	0.0000	0.0000	pass	keep	generation_round	generated billing_clarity_reset:s671
155	0.0000	0.0000	0.0000	0.0000	0.0000	0.0000	pass	keep	generation_round	generated billing_clarity_reset:s672
155	0.0000	0.0000	0.0000	0.0000	0.0000	0.0000	pass	keep	generation_round	generated control_empathic_exit:s673
155	0.0000	0.0000	0.0000	0.0000	0.0000	0.0000	pass	keep	generation_round	generated control_empathic_exit:s674
155	0.0000	0.0000	0.0000	0.0000	0.0000	0.0000	pass	keep	generation_round	generated control_empathic_exit:s675
155	0.0000	0.0000	0.0000	0.0000	0.0000	0.0000	pass	keep	generation_round	synced strategy_arms for pause_plan_relief (8 strategies)
155	0.0000	0.0000	0.0000	0.0000	0.0000	0.0000	pass	keep	generation_round	synced strategy_arms for downgrade_lite_switch (8 strategies)
155	0.0000	0.0000	0.0000	0.0000	0.0000	0.0000	pass	keep	generation_round	synced strategy_arms for targeted_discount_20 (8 strategies)
155	0.0000	0.0000	0.0000	0.0000	0.0000	0.0000	pass	keep	generation_round	synced strategy_arms for targeted_discount_40 (8 strategies)
155	0.0000	0.0000	0.0000	0.0000	0.0000	0.0000	pass	keep	generation_round	synced strategy_arms for concierge_recovery (8 strategies)
155	0.0000	0.0000	0.0000	0.0000	0.0000	0.0000	pass	keep	generation_round	synced strategy_arms for exam_sprint_focus (8 strategies)
155	0.0000	0.0000	0.0000	0.0000	0.0000	0.0000	pass	keep	generation_round	synced strategy_arms for feature_value_recap (8 strategies)
155	0.0000	0.0000	0.0000	0.0000	0.0000	0.0000	pass	keep	generation_round	synced strategy_arms for billing_clarity_reset (8 strategies)
155	0.0000	0.0000	0.0000	0.0000	0.0000	0.0000	pass	keep	generation_round	synced strategy_arms for control_empathic_exit (8 strategies)
155	0.0000	0.0000	0.0000	0.0000	0.0000	0.0000	pass	keep	generation_round	pruned pause_plan_relief: ['s651', 's650', 's649']
155	0.0000	0.0000	0.0000	0.0000	0.0000	0.0000	pass	keep	generation_round	pruned downgrade_lite_switch: ['s653', 's654', 's652']
155	0.0000	0.0000	0.0000	0.0000	0.0000	0.0000	pass	keep	generation_round	pruned targeted_discount_20: ['s602', 's655', 's656']
155	0.0000	0.0000	0.0000	0.0000	0.0000	0.0000	pass	keep	generation_round	pruned targeted_discount_40: ['s658', 's660', 's659']
155	0.0000	0.0000	0.0000	0.0000	0.0000	0.0000	pass	keep	generation_round	pruned concierge_recovery: ['s662', 's663', 's661']
155	0.0000	0.0000	0.0000	0.0000	0.0000	0.0000	pass	keep	generation_round	pruned exam_sprint_focus: ['s666', 's665', 's664']
155	0.0000	0.0000	0.0000	0.0000	0.0000	0.0000	pass	keep	generation_round	pruned feature_value_recap: ['s669', 's668', 's667']
155	0.0000	0.0000	0.0000	0.0000	0.0000	0.0000	pass	keep	generation_round	pruned billing_clarity_reset: ['s672', 's671', 's670']
155	0.0000	0.0000	0.0000	0.0000	0.0000	0.0000	pass	keep	generation_round	pruned control_empathic_exit: ['s674', 's675', 's673']
155	0.0000	0.0000	0.0000	0.0000	0.0000	0.0000	pass	keep	generation_round	generation 25 complete
156	0.8049	0.8009	0.0000	0.0000	0.5574	0.7634	pass	discard	context_arms	[Lifecycle Strategist] [LLM] context graduating|free|downgrade_lite_switch alpha+=3, beta+=0 — Users in a graduating lifecycle stage on the free plan show the clearest positive signal for a lighter-commitment downgrade path, so increasing preference for this reason+plan+action combo should lift saves without adding trust risk.
157	0.8023	0.8013	-0.0027	0.0004	0.5546	0.7647	pass	discard	arm_priors	[Support Concierge] [LLM] concierge_recovery alpha+=4, beta+=0 — Concierge recovery is already a top-performing non-discount arm with strong strategy quality, so a modest alpha increase should route slightly more traffic toward warm human handoff without introducing trust risk.
158	0.8049	0.8009	0.0000	0.0000	0.5574	0.7634	pass	discard	reason_routing	[Trust Guardian] [LLM] deny targeted_discount_40 for quality_bug — Blocking the steep discount for quality_bug avoids a manipulative mismatch that would likely damage trust, while routing those users toward non-price recovery options should preserve or improve saves more sustainably.
159	0.8049	0.8009	0.0000	0.0000	0.5574	0.7634	pass	discard	exploration_rate	[Experiment Operator] [LLM] exploration_rate 0.150 -> 0.030 — With only 300 resolved outcomes and multiple strong non-control arms already showing clear separation from control, cutting exploration to 3% should route more traffic to proven high-save actions and improve save_rate without increasing trust risk.
160	0.8037	0.8011	-0.0012	0.0002	0.5519	0.7637	pass	discard	arm_priors	[Product Storyteller] [LLM] feature_value_recap alpha+=4, beta+=0 — Feature_value_recap is already a strong non-discount save path with solid volume, so modestly favoring it should increase saves by surfacing earned product value before resorting to heavier interventions.
160	0.0000	0.0000	0.0000	0.0000	0.0000	0.0000	pass	keep	generation_round	generated pause_plan_relief:s676
160	0.0000	0.0000	0.0000	0.0000	0.0000	0.0000	pass	keep	generation_round	generated pause_plan_relief:s677
160	0.0000	0.0000	0.0000	0.0000	0.0000	0.0000	pass	keep	generation_round	generated pause_plan_relief:s678
160	0.0000	0.0000	0.0000	0.0000	0.0000	0.0000	pass	keep	generation_round	generated downgrade_lite_switch:s679
160	0.0000	0.0000	0.0000	0.0000	0.0000	0.0000	pass	keep	generation_round	generated downgrade_lite_switch:s680
160	0.0000	0.0000	0.0000	0.0000	0.0000	0.0000	pass	keep	generation_round	generated downgrade_lite_switch:s681
160	0.0000	0.0000	0.0000	0.0000	0.0000	0.0000	pass	keep	generation_round	generated targeted_discount_20:s682
160	0.0000	0.0000	0.0000	0.0000	0.0000	0.0000	pass	keep	generation_round	generated targeted_discount_20:s683
160	0.0000	0.0000	0.0000	0.0000	0.0000	0.0000	pass	keep	generation_round	generated targeted_discount_20:s684
160	0.0000	0.0000	0.0000	0.0000	0.0000	0.0000	pass	keep	generation_round	generated targeted_discount_40:s685
160	0.0000	0.0000	0.0000	0.0000	0.0000	0.0000	pass	keep	generation_round	generated targeted_discount_40:s686
160	0.0000	0.0000	0.0000	0.0000	0.0000	0.0000	pass	keep	generation_round	generated targeted_discount_40:s687
160	0.0000	0.0000	0.0000	0.0000	0.0000	0.0000	pass	keep	generation_round	generated concierge_recovery:s688
160	0.0000	0.0000	0.0000	0.0000	0.0000	0.0000	pass	keep	generation_round	generated concierge_recovery:s689
160	0.0000	0.0000	0.0000	0.0000	0.0000	0.0000	pass	keep	generation_round	generated concierge_recovery:s690
160	0.0000	0.0000	0.0000	0.0000	0.0000	0.0000	pass	keep	generation_round	generated exam_sprint_focus:s691
160	0.0000	0.0000	0.0000	0.0000	0.0000	0.0000	pass	keep	generation_round	generated exam_sprint_focus:s692
160	0.0000	0.0000	0.0000	0.0000	0.0000	0.0000	pass	keep	generation_round	generated exam_sprint_focus:s693
160	0.0000	0.0000	0.0000	0.0000	0.0000	0.0000	pass	keep	generation_round	generated feature_value_recap:s694
160	0.0000	0.0000	0.0000	0.0000	0.0000	0.0000	pass	keep	generation_round	generated feature_value_recap:s695
160	0.0000	0.0000	0.0000	0.0000	0.0000	0.0000	pass	keep	generation_round	generated feature_value_recap:s696
160	0.0000	0.0000	0.0000	0.0000	0.0000	0.0000	pass	keep	generation_round	generated billing_clarity_reset:s697
160	0.0000	0.0000	0.0000	0.0000	0.0000	0.0000	pass	keep	generation_round	generated billing_clarity_reset:s698
160	0.0000	0.0000	0.0000	0.0000	0.0000	0.0000	pass	keep	generation_round	generated billing_clarity_reset:s699
160	0.0000	0.0000	0.0000	0.0000	0.0000	0.0000	pass	keep	generation_round	generated control_empathic_exit:s700
160	0.0000	0.0000	0.0000	0.0000	0.0000	0.0000	pass	keep	generation_round	generated control_empathic_exit:s701
160	0.0000	0.0000	0.0000	0.0000	0.0000	0.0000	pass	keep	generation_round	generated control_empathic_exit:s702
160	0.0000	0.0000	0.0000	0.0000	0.0000	0.0000	pass	keep	generation_round	synced strategy_arms for pause_plan_relief (8 strategies)
160	0.0000	0.0000	0.0000	0.0000	0.0000	0.0000	pass	keep	generation_round	synced strategy_arms for downgrade_lite_switch (8 strategies)
160	0.0000	0.0000	0.0000	0.0000	0.0000	0.0000	pass	keep	generation_round	synced strategy_arms for targeted_discount_20 (8 strategies)
160	0.0000	0.0000	0.0000	0.0000	0.0000	0.0000	pass	keep	generation_round	synced strategy_arms for targeted_discount_40 (8 strategies)
160	0.0000	0.0000	0.0000	0.0000	0.0000	0.0000	pass	keep	generation_round	synced strategy_arms for concierge_recovery (8 strategies)
160	0.0000	0.0000	0.0000	0.0000	0.0000	0.0000	pass	keep	generation_round	synced strategy_arms for exam_sprint_focus (8 strategies)
160	0.0000	0.0000	0.0000	0.0000	0.0000	0.0000	pass	keep	generation_round	synced strategy_arms for feature_value_recap (8 strategies)
160	0.0000	0.0000	0.0000	0.0000	0.0000	0.0000	pass	keep	generation_round	synced strategy_arms for billing_clarity_reset (8 strategies)
160	0.0000	0.0000	0.0000	0.0000	0.0000	0.0000	pass	keep	generation_round	synced strategy_arms for control_empathic_exit (8 strategies)
160	0.0000	0.0000	0.0000	0.0000	0.0000	0.0000	pass	keep	generation_round	pruned pause_plan_relief: ['s677', 's676', 's678']
160	0.0000	0.0000	0.0000	0.0000	0.0000	0.0000	pass	keep	generation_round	pruned downgrade_lite_switch: ['s679', 's681', 's680']
