run_id	save_rate	average_reward	save_lift	reward_lift	alignment	trust	regression	status	mutation_type	description
115	0.0000	0.0000	0.0000	0.0000	0.0000	0.0000	pass	keep	generation_round	pruned pause_plan_relief: ['s83', 's435', 's434']
115	0.0000	0.0000	0.0000	0.0000	0.0000	0.0000	pass	keep	generation_round	pruned downgrade_lite_switch: ['s436', 's437', 's438']
115	0.0000	0.0000	0.0000	0.0000	0.0000	0.0000	pass	keep	generation_round	pruned targeted_discount_20: ['s441', 's440', 's439']
115	0.0000	0.0000	0.0000	0.0000	0.0000	0.0000	pass	keep	generation_round	pruned targeted_discount_40: ['s443', 's442', 's444']
115	0.0000	0.0000	0.0000	0.0000	0.0000	0.0000	pass	keep	generation_round	pruned concierge_recovery: ['s447', 's446', 's445']
115	0.0000	0.0000	0.0000	0.0000	0.0000	0.0000	pass	keep	generation_round	pruned exam_sprint_focus: ['s450', 's448', 's449']
115	0.0000	0.0000	0.0000	0.0000	0.0000	0.0000	pass	keep	generation_round	pruned feature_value_recap: ['s181', 's453', 's452']
115	0.0000	0.0000	0.0000	0.0000	0.0000	0.0000	pass	keep	generation_round	pruned billing_clarity_reset: ['s455', 's456', 's454']
115	0.0000	0.0000	0.0000	0.0000	0.0000	0.0000	pass	keep	generation_round	pruned control_empathic_exit: ['s457', 's459', 's458']
115	0.0000	0.0000	0.0000	0.0000	0.0000	0.0000	pass	keep	generation_round	generation 17 complete
116	0.8048	0.8008	0.0000	0.0000	0.5574	0.7689	pass	discard	context_arms	[Deadline Operator] [LLM] context graduating|free|exam_sprint_focus alpha+=3, beta+=0 — For users facing a near-term graduation deadline, modestly favoring exam_sprint_focus should improve saves by matching the highest-leverage short-horizon need without introducing trust risk.
117	0.8045	0.8009	-0.0003	0.0000	0.5546	0.7691	pass	discard	context_arms	[Win-Back Researcher] [LLM] context other|free|concierge_recovery alpha+=3, beta+=0 — Dormant or fatigued free users often need a low-pressure human-assisted comeback path, and the strongest observed win-back signal in this segment is other|free|concierge_recovery (4 impressions, 1.0 win_rate), so modestly favoring it should lift saves without adding pressure or eroding trust.
118	0.8048	0.8008	0.0000	0.0000	0.5574	0.7689	pass	discard	context_arms	[Retention Psychologist] [LLM] context graduating|free|downgrade_lite_switch alpha+=3, beta+=0 — Learners signaling graduation are most persuadable by identity-preserving continuity over cancellation, and this context already shows the strongest habit-loop retention signal without requiring trust-eroding discount pressure.
119	0.8045	0.8011	-0.0004	0.0002	0.5628	0.7674	pass	discard	arm_priors	[Offer Economist] [LLM] targeted_discount_20 alpha+=3, beta+=0 — A modest additional prior boost to targeted_discount_20 should shift traffic toward the more efficient discount point that already showed positive lift in run 110, improving saves without increasing discount generosity or trust risk.
120	0.8048	0.8008	0.0000	0.0000	0.5574	0.7689	pass	discard	context_arms	[Lifecycle Strategist] [LLM] context graduating|free|downgrade_lite_switch alpha+=3, beta+=0 — Users signaling graduation are in a natural lifecycle-downshift stage, and reinforcing downgrade_lite_switch for graduating|free matches that need with a lower-commitment path already showing the strongest observed contextual save rate.
120	0.0000	0.0000	0.0000	0.0000	0.0000	0.0000	pass	keep	generation_round	generated pause_plan_relief:s460
120	0.0000	0.0000	0.0000	0.0000	0.0000	0.0000	pass	keep	generation_round	generated pause_plan_relief:s461
120	0.0000	0.0000	0.0000	0.0000	0.0000	0.0000	pass	keep	generation_round	generated pause_plan_relief:s462
120	0.0000	0.0000	0.0000	0.0000	0.0000	0.0000	pass	keep	generation_round	generated downgrade_lite_switch:s463
120	0.0000	0.0000	0.0000	0.0000	0.0000	0.0000	pass	keep	generation_round	generated downgrade_lite_switch:s464
120	0.0000	0.0000	0.0000	0.0000	0.0000	0.0000	pass	keep	generation_round	generated downgrade_lite_switch:s465
120	0.0000	0.0000	0.0000	0.0000	0.0000	0.0000	pass	keep	generation_round	generated targeted_discount_20:s466
120	0.0000	0.0000	0.0000	0.0000	0.0000	0.0000	pass	keep	generation_round	generated targeted_discount_20:s467
120	0.0000	0.0000	0.0000	0.0000	0.0000	0.0000	pass	keep	generation_round	generated targeted_discount_20:s468
120	0.0000	0.0000	0.0000	0.0000	0.0000	0.0000	pass	keep	generation_round	generated targeted_discount_40:s469
120	0.0000	0.0000	0.0000	0.0000	0.0000	0.0000	pass	keep	generation_round	generated targeted_discount_40:s470
120	0.0000	0.0000	0.0000	0.0000	0.0000	0.0000	pass	keep	generation_round	generated targeted_discount_40:s471
120	0.0000	0.0000	0.0000	0.0000	0.0000	0.0000	pass	keep	generation_round	generated concierge_recovery:s472
120	0.0000	0.0000	0.0000	0.0000	0.0000	0.0000	pass	keep	generation_round	generated concierge_recovery:s473
120	0.0000	0.0000	0.0000	0.0000	0.0000	0.0000	pass	keep	generation_round	generated concierge_recovery:s474
120	0.0000	0.0000	0.0000	0.0000	0.0000	0.0000	pass	keep	generation_round	generated exam_sprint_focus:s475
120	0.0000	0.0000	0.0000	0.0000	0.0000	0.0000	pass	keep	generation_round	generated exam_sprint_focus:s476
120	0.0000	0.0000	0.0000	0.0000	0.0000	0.0000	pass	keep	generation_round	generated exam_sprint_focus:s477
120	0.0000	0.0000	0.0000	0.0000	0.0000	0.0000	pass	keep	generation_round	generated feature_value_recap:s478
120	0.0000	0.0000	0.0000	0.0000	0.0000	0.0000	pass	keep	generation_round	generated feature_value_recap:s479
120	0.0000	0.0000	0.0000	0.0000	0.0000	0.0000	pass	keep	generation_round	generated feature_value_recap:s480
120	0.0000	0.0000	0.0000	0.0000	0.0000	0.0000	pass	keep	generation_round	generated billing_clarity_reset:s481
120	0.0000	0.0000	0.0000	0.0000	0.0000	0.0000	pass	keep	generation_round	generated billing_clarity_reset:s482
120	0.0000	0.0000	0.0000	0.0000	0.0000	0.0000	pass	keep	generation_round	generated billing_clarity_reset:s483
120	0.0000	0.0000	0.0000	0.0000	0.0000	0.0000	pass	keep	generation_round	generated control_empathic_exit:s484
120	0.0000	0.0000	0.0000	0.0000	0.0000	0.0000	pass	keep	generation_round	generated control_empathic_exit:s485
120	0.0000	0.0000	0.0000	0.0000	0.0000	0.0000	pass	keep	generation_round	generated control_empathic_exit:s486
120	0.0000	0.0000	0.0000	0.0000	0.0000	0.0000	pass	keep	generation_round	synced strategy_arms for pause_plan_relief (8 strategies)
120	0.0000	0.0000	0.0000	0.0000	0.0000	0.0000	pass	keep	generation_round	synced strategy_arms for downgrade_lite_switch (8 strategies)
120	0.0000	0.0000	0.0000	0.0000	0.0000	0.0000	pass	keep	generation_round	synced strategy_arms for targeted_discount_20 (8 strategies)
120	0.0000	0.0000	0.0000	0.0000	0.0000	0.0000	pass	keep	generation_round	synced strategy_arms for targeted_discount_40 (8 strategies)
120	0.0000	0.0000	0.0000	0.0000	0.0000	0.0000	pass	keep	generation_round	synced strategy_arms for concierge_recovery (8 strategies)
120	0.0000	0.0000	0.0000	0.0000	0.0000	0.0000	pass	keep	generation_round	synced strategy_arms for exam_sprint_focus (8 strategies)
120	0.0000	0.0000	0.0000	0.0000	0.0000	0.0000	pass	keep	generation_round	synced strategy_arms for feature_value_recap (8 strategies)
120	0.0000	0.0000	0.0000	0.0000	0.0000	0.0000	pass	keep	generation_round	synced strategy_arms for billing_clarity_reset (8 strategies)
120	0.0000	0.0000	0.0000	0.0000	0.0000	0.0000	pass	keep	generation_round	synced strategy_arms for control_empathic_exit (8 strategies)
120	0.0000	0.0000	0.0000	0.0000	0.0000	0.0000	pass	keep	generation_round	pruned pause_plan_relief: ['s461', 's57', 's462']
120	0.0000	0.0000	0.0000	0.0000	0.0000	0.0000	pass	keep	generation_round	pruned downgrade_lite_switch: ['s409', 's463', 's464']
120	0.0000	0.0000	0.0000	0.0000	0.0000	0.0000	pass	keep	generation_round	pruned targeted_discount_20: ['s468', 's466', 's467']
120	0.0000	0.0000	0.0000	0.0000	0.0000	0.0000	pass	keep	generation_round	pruned targeted_discount_40: ['s470', 's469', 's471']
120	0.0000	0.0000	0.0000	0.0000	0.0000	0.0000	pass	keep	generation_round	pruned concierge_recovery: ['s472', 's474', 's473']
120	0.0000	0.0000	0.0000	0.0000	0.0000	0.0000	pass	keep	generation_round	pruned exam_sprint_focus: ['s475', 's476', 's477']
120	0.0000	0.0000	0.0000	0.0000	0.0000	0.0000	pass	keep	generation_round	pruned feature_value_recap: ['s478', 's480', 's479']
120	0.0000	0.0000	0.0000	0.0000	0.0000	0.0000	pass	keep	generation_round	pruned billing_clarity_reset: ['s483', 's481', 's482']
120	0.0000	0.0000	0.0000	0.0000	0.0000	0.0000	pass	keep	generation_round	pruned control_empathic_exit: ['s485', 's486', 's484']
120	0.0000	0.0000	0.0000	0.0000	0.0000	0.0000	pass	keep	generation_round	generation 18 complete
121	0.8020	0.8011	-0.0027	0.0004	0.5546	0.7698	pass	discard	arm_priors	[Support Concierge] [LLM] concierge_recovery alpha+=4, beta+=0 — Concierge recovery is already a top-performing non-discount path with strong strategy quality, so a modest alpha increase should route slightly more traffic to a trust-preserving human handoff without overcommitting exploration.
122	0.8047	0.8008	0.0000	0.0000	0.5574	0.7685	pass	discard	reason_routing	[Trust Guardian] [LLM] deny concierge_recovery for quality_bug — Users citing product quality issues are unlikely to trust a high-touch save attempt, so blocking concierge_recovery for quality_bug should reduce manipulative mismatches and shift traffic toward less trust-eroding exits without materially hurting saves.
123	0.8047	0.8008	0.0000	0.0000	0.5574	0.7685	pass	discard	exploration_rate	[Experiment Operator] [LLM] exploration_rate 0.150 -> 0.080 — With only 300 resolved outcomes and several high-performing arms already identified, lowering exploration from 0.15 to 0.08 should reduce waste on weak/uncertain traffic while preserving enough learning to avoid harming trust.
124	0.8040	0.8006	-0.0007	-0.0002	0.5546	0.7686	pass	discard	context_arms	[Product Storyteller] [LLM] context feature_gap|free|feature_value_recap alpha+=3, beta+=0 — Users canceling for feature-gap on free plans are strong candidates for product-led value realization, so boosting feature_value_recap in this context should surface an earned save path without adding pressure or trust risk.
125	0.8047	0.8008	0.0000	0.0000	0.5574	0.7685	pass	discard	context_arms	[Deadline Operator] [LLM] context graduating|free|exam_sprint_focus alpha+=3, beta+=0 — For exam- or deadline-driven free users nearing graduation, the next few days are likely the highest-leverage window, so modestly favoring exam_sprint_focus in this context should lift saves without reducing trust.
125	0.0000	0.0000	0.0000	0.0000	0.0000	0.0000	pass	keep	generation_round	generated pause_plan_relief:s487
125	0.0000	0.0000	0.0000	0.0000	0.0000	0.0000	pass	keep	generation_round	generated pause_plan_relief:s488
125	0.0000	0.0000	0.0000	0.0000	0.0000	0.0000	pass	keep	generation_round	generated pause_plan_relief:s489
125	0.0000	0.0000	0.0000	0.0000	0.0000	0.0000	pass	keep	generation_round	generated downgrade_lite_switch:s490
125	0.0000	0.0000	0.0000	0.0000	0.0000	0.0000	pass	keep	generation_round	generated downgrade_lite_switch:s491
125	0.0000	0.0000	0.0000	0.0000	0.0000	0.0000	pass	keep	generation_round	generated downgrade_lite_switch:s492
125	0.0000	0.0000	0.0000	0.0000	0.0000	0.0000	pass	keep	generation_round	generated targeted_discount_20:s493
125	0.0000	0.0000	0.0000	0.0000	0.0000	0.0000	pass	keep	generation_round	generated targeted_discount_20:s494
125	0.0000	0.0000	0.0000	0.0000	0.0000	0.0000	pass	keep	generation_round	generated targeted_discount_20:s495
125	0.0000	0.0000	0.0000	0.0000	0.0000	0.0000	pass	keep	generation_round	generated targeted_discount_40:s496
125	0.0000	0.0000	0.0000	0.0000	0.0000	0.0000	pass	keep	generation_round	generated targeted_discount_40:s497
125	0.0000	0.0000	0.0000	0.0000	0.0000	0.0000	pass	keep	generation_round	generated targeted_discount_40:s498
125	0.0000	0.0000	0.0000	0.0000	0.0000	0.0000	pass	keep	generation_round	generated concierge_recovery:s499
125	0.0000	0.0000	0.0000	0.0000	0.0000	0.0000	pass	keep	generation_round	generated concierge_recovery:s500
125	0.0000	0.0000	0.0000	0.0000	0.0000	0.0000	pass	keep	generation_round	generated concierge_recovery:s501
125	0.0000	0.0000	0.0000	0.0000	0.0000	0.0000	pass	keep	generation_round	generated exam_sprint_focus:s502
125	0.0000	0.0000	0.0000	0.0000	0.0000	0.0000	pass	keep	generation_round	generated exam_sprint_focus:s503
125	0.0000	0.0000	0.0000	0.0000	0.0000	0.0000	pass	keep	generation_round	generated exam_sprint_focus:s504
125	0.0000	0.0000	0.0000	0.0000	0.0000	0.0000	pass	keep	generation_round	generated feature_value_recap:s505
125	0.0000	0.0000	0.0000	0.0000	0.0000	0.0000	pass	keep	generation_round	generated feature_value_recap:s506
125	0.0000	0.0000	0.0000	0.0000	0.0000	0.0000	pass	keep	generation_round	generated feature_value_recap:s507
125	0.0000	0.0000	0.0000	0.0000	0.0000	0.0000	pass	keep	generation_round	generated billing_clarity_reset:s508
125	0.0000	0.0000	0.0000	0.0000	0.0000	0.0000	pass	keep	generation_round	generated billing_clarity_reset:s509
125	0.0000	0.0000	0.0000	0.0000	0.0000	0.0000	pass	keep	generation_round	generated billing_clarity_reset:s510
125	0.0000	0.0000	0.0000	0.0000	0.0000	0.0000	pass	keep	generation_round	generated control_empathic_exit:s511
125	0.0000	0.0000	0.0000	0.0000	0.0000	0.0000	pass	keep	generation_round	generated control_empathic_exit:s512
125	0.0000	0.0000	0.0000	0.0000	0.0000	0.0000	pass	keep	generation_round	generated control_empathic_exit:s513
125	0.0000	0.0000	0.0000	0.0000	0.0000	0.0000	pass	keep	generation_round	synced strategy_arms for pause_plan_relief (8 strategies)
125	0.0000	0.0000	0.0000	0.0000	0.0000	0.0000	pass	keep	generation_round	synced strategy_arms for downgrade_lite_switch (8 strategies)
125	0.0000	0.0000	0.0000	0.0000	0.0000	0.0000	pass	keep	generation_round	synced strategy_arms for targeted_discount_20 (8 strategies)
125	0.0000	0.0000	0.0000	0.0000	0.0000	0.0000	pass	keep	generation_round	synced strategy_arms for targeted_discount_40 (8 strategies)
125	0.0000	0.0000	0.0000	0.0000	0.0000	0.0000	pass	keep	generation_round	synced strategy_arms for concierge_recovery (8 strategies)
125	0.0000	0.0000	0.0000	0.0000	0.0000	0.0000	pass	keep	generation_round	synced strategy_arms for exam_sprint_focus (8 strategies)
125	0.0000	0.0000	0.0000	0.0000	0.0000	0.0000	pass	keep	generation_round	synced strategy_arms for feature_value_recap (8 strategies)
125	0.0000	0.0000	0.0000	0.0000	0.0000	0.0000	pass	keep	generation_round	synced strategy_arms for billing_clarity_reset (8 strategies)
125	0.0000	0.0000	0.0000	0.0000	0.0000	0.0000	pass	keep	generation_round	synced strategy_arms for control_empathic_exit (8 strategies)
125	0.0000	0.0000	0.0000	0.0000	0.0000	0.0000	pass	keep	generation_round	pruned pause_plan_relief: ['s487', 's0', 's488']
125	0.0000	0.0000	0.0000	0.0000	0.0000	0.0000	pass	keep	generation_round	pruned downgrade_lite_switch: ['s465', 's490', 's492']
125	0.0000	0.0000	0.0000	0.0000	0.0000	0.0000	pass	keep	generation_round	pruned targeted_discount_20: ['s495', 's493', 's494']
125	0.0000	0.0000	0.0000	0.0000	0.0000	0.0000	pass	keep	generation_round	pruned targeted_discount_40: ['s496', 's498', 's497']
125	0.0000	0.0000	0.0000	0.0000	0.0000	0.0000	pass	keep	generation_round	pruned concierge_recovery: ['s500', 's499', 's501']
125	0.0000	0.0000	0.0000	0.0000	0.0000	0.0000	pass	keep	generation_round	pruned exam_sprint_focus: ['s504', 's503', 's502']
125	0.0000	0.0000	0.0000	0.0000	0.0000	0.0000	pass	keep	generation_round	pruned feature_value_recap: ['s506', 's505', 's507']
125	0.0000	0.0000	0.0000	0.0000	0.0000	0.0000	pass	keep	generation_round	pruned billing_clarity_reset: ['s510', 's509', 's508']
125	0.0000	0.0000	0.0000	0.0000	0.0000	0.0000	pass	keep	generation_round	pruned control_empathic_exit: ['s511', 's512', 's513']
125	0.0000	0.0000	0.0000	0.0000	0.0000	0.0000	pass	keep	generation_round	generation 19 complete
126	0.8047	0.8008	0.0000	0.0000	0.5574	0.7685	pass	discard	context_arms	[Win-Back Researcher] [LLM] context break|free|pause_plan_relief alpha+=3, beta+=0 — Dormant or fatigued users citing a break respond best to a low-pressure comeback path, and reinforcing pause_plan_relief in this context should raise saves without undermining trust.
127	0.8018	0.7983	-0.0029	-0.0025	0.5683	0.7685	pass	discard	arm_priors	[Retention Psychologist] [LLM] pause_plan_relief alpha+=4, beta+=0 — Favoring pause_plan_relief should improve saves by preserving learner identity and habit continuity for users who want a break, leveraging momentum without relying on trust-eroding discounts.
128	0.8047	0.8008	0.0000	0.0000	0.5574	0.7685	pass	discard	discount_cap	[Offer Economist] [LLM] discount_cap 1 -> 0 — Discount arms are not clearly outperforming non-discount saves enough to justify subsidy, and removing discounts should shift traffic toward pause/downgrade/value actions on the efficient frontier, preserving trust while improving net save efficiency.
129	0.8047	0.8008	0.0000	0.0000	0.5574	0.7685	pass	discard	context_arms	[Lifecycle Strategist] [LLM] context break|free|pause_plan_relief alpha+=3, beta+=0 — Users signaling a temporary break are a strong lifecycle match for pause rather than cancellation, and this context already shows the best observed fit, so modestly favoring it should lift saves without undermining trust.
130	0.8047	0.8008	0.0000	0.0000	0.5574	0.7685	pass	discard	exploration_rate	[Support Concierge] [LLM] exploration_rate 0.150 -> 0.080 — Reduce exploration so more traffic concentrates on already strong, trust-preserving non-discount winners like concierge_recovery while current data volume is too low to justify broad exploration.
130	0.0000	0.0000	0.0000	0.0000	0.0000	0.0000	pass	keep	generation_round	generated pause_plan_relief:s514
130	0.0000	0.0000	0.0000	0.0000	0.0000	0.0000	pass	keep	generation_round	generated pause_plan_relief:s515
130	0.0000	0.0000	0.0000	0.0000	0.0000	0.0000	pass	keep	generation_round	generated pause_plan_relief:s516
130	0.0000	0.0000	0.0000	0.0000	0.0000	0.0000	pass	keep	generation_round	generated downgrade_lite_switch:s517
130	0.0000	0.0000	0.0000	0.0000	0.0000	0.0000	pass	keep	generation_round	generated downgrade_lite_switch:s518
130	0.0000	0.0000	0.0000	0.0000	0.0000	0.0000	pass	keep	generation_round	generated downgrade_lite_switch:s519
130	0.0000	0.0000	0.0000	0.0000	0.0000	0.0000	pass	keep	generation_round	generated targeted_discount_20:s520
130	0.0000	0.0000	0.0000	0.0000	0.0000	0.0000	pass	keep	generation_round	generated targeted_discount_20:s521
130	0.0000	0.0000	0.0000	0.0000	0.0000	0.0000	pass	keep	generation_round	generated targeted_discount_20:s522
130	0.0000	0.0000	0.0000	0.0000	0.0000	0.0000	pass	keep	generation_round	generated targeted_discount_40:s523
130	0.0000	0.0000	0.0000	0.0000	0.0000	0.0000	pass	keep	generation_round	generated targeted_discount_40:s524
130	0.0000	0.0000	0.0000	0.0000	0.0000	0.0000	pass	keep	generation_round	generated targeted_discount_40:s525
130	0.0000	0.0000	0.0000	0.0000	0.0000	0.0000	pass	keep	generation_round	generated concierge_recovery:s526
130	0.0000	0.0000	0.0000	0.0000	0.0000	0.0000	pass	keep	generation_round	generated concierge_recovery:s527
130	0.0000	0.0000	0.0000	0.0000	0.0000	0.0000	pass	keep	generation_round	generated concierge_recovery:s528
130	0.0000	0.0000	0.0000	0.0000	0.0000	0.0000	pass	keep	generation_round	generated exam_sprint_focus:s529
130	0.0000	0.0000	0.0000	0.0000	0.0000	0.0000	pass	keep	generation_round	generated exam_sprint_focus:s530
130	0.0000	0.0000	0.0000	0.0000	0.0000	0.0000	pass	keep	generation_round	generated exam_sprint_focus:s531
130	0.0000	0.0000	0.0000	0.0000	0.0000	0.0000	pass	keep	generation_round	generated feature_value_recap:s532
130	0.0000	0.0000	0.0000	0.0000	0.0000	0.0000	pass	keep	generation_round	generated feature_value_recap:s533
130	0.0000	0.0000	0.0000	0.0000	0.0000	0.0000	pass	keep	generation_round	generated feature_value_recap:s534
130	0.0000	0.0000	0.0000	0.0000	0.0000	0.0000	pass	keep	generation_round	generated billing_clarity_reset:s535
130	0.0000	0.0000	0.0000	0.0000	0.0000	0.0000	pass	keep	generation_round	generated billing_clarity_reset:s536
130	0.0000	0.0000	0.0000	0.0000	0.0000	0.0000	pass	keep	generation_round	generated billing_clarity_reset:s537
130	0.0000	0.0000	0.0000	0.0000	0.0000	0.0000	pass	keep	generation_round	generated control_empathic_exit:s538
130	0.0000	0.0000	0.0000	0.0000	0.0000	0.0000	pass	keep	generation_round	generated control_empathic_exit:s539
130	0.0000	0.0000	0.0000	0.0000	0.0000	0.0000	pass	keep	generation_round	generated control_empathic_exit:s540
130	0.0000	0.0000	0.0000	0.0000	0.0000	0.0000	pass	keep	generation_round	synced strategy_arms for pause_plan_relief (8 strategies)
130	0.0000	0.0000	0.0000	0.0000	0.0000	0.0000	pass	keep	generation_round	synced strategy_arms for downgrade_lite_switch (8 strategies)
130	0.0000	0.0000	0.0000	0.0000	0.0000	0.0000	pass	keep	generation_round	synced strategy_arms for targeted_discount_20 (8 strategies)
130	0.0000	0.0000	0.0000	0.0000	0.0000	0.0000	pass	keep	generation_round	synced strategy_arms for targeted_discount_40 (8 strategies)
130	0.0000	0.0000	0.0000	0.0000	0.0000	0.0000	pass	keep	generation_round	synced strategy_arms for concierge_recovery (8 strategies)
130	0.0000	0.0000	0.0000	0.0000	0.0000	0.0000	pass	keep	generation_round	synced strategy_arms for exam_sprint_focus (8 strategies)
130	0.0000	0.0000	0.0000	0.0000	0.0000	0.0000	pass	keep	generation_round	synced strategy_arms for feature_value_recap (8 strategies)
130	0.0000	0.0000	0.0000	0.0000	0.0000	0.0000	pass	keep	generation_round	synced strategy_arms for billing_clarity_reset (8 strategies)
130	0.0000	0.0000	0.0000	0.0000	0.0000	0.0000	pass	keep	generation_round	synced strategy_arms for control_empathic_exit (8 strategies)
130	0.0000	0.0000	0.0000	0.0000	0.0000	0.0000	pass	keep	generation_round	pruned pause_plan_relief: ['s516', 's514', 's515']
